CommentID,Comment,LikeCount
UgyVx2ztjPmzq9u7i154AaABAg,"6.9e+13 possible chess games.  Known as the Shannon number <a href=""https://en.wikipedia.org/wiki/Shannon_number"">https://en.wikipedia.org/wiki/Shannon_number</a>",0
UgxRne9fEyE2gRqUjZ14AaABAg,"What is killer is you are ushering in prophecy.Thank you ....Jesus said heaven and earth would pass away before his word would not come true,so lets see.",0
Ugw-9HDYCaP55HsAg3N4AaABAg,"Keep doing these, man.",0
UgywoTMH4h6cEyzeRjx4AaABAg,"Protein folding starts at <a href=""https://www.youtube.com/watch?v=W7wJDJ56c88&amp;t=282"">4:42</a>.<br>Lex, you&#39;re a bright lad and you have good ideas -- but you sure need an editor.",4
UgwNWCSy-exq8iRwbqx4AaABAg,"It should be law, as gods of a digital universe we create to make sure everything we create is never in pain, to show we are better than the creators of our universe. Also we should signpost on every atom, this place is an illusion and the direction to the real place.",0
Ugw3ihOtCWWJwge6kGh4AaABAg,Your videos are very very informative and teach concepts that matter(to me at least).  Grateful for your time and effort.  Keep dishing out more!!,0
UgzFOq96OVKCtLncML94AaABAg,Could this lead to a treatment or cure for prion diseases?,0
UgzhqLVHNixgIRIohx94AaABAg,These short videos are fun for us too. Thank you Lex for teaching us in a way we can easily understand.,0
Ugyj_PGN684GQCnygwZ4AaABAg,"&quot;Inspiring beyond words&quot;. I could not describe my feelings upon hearing this news, but here ut is! Thanks for the video!",0
UgwaiM29UyB0mlpDxEF4AaABAg,Please keep doing this type of videos! Very informative and fun!!!,0
UgwK9gn3FyAAizSB4_d4AaABAg,"&quot;Like a circle in a spiral, like a wheel within a wheel, never-ending or beginning on an ever spinning reel..&quot;",4
Ugzj4MZVDbAMmfu6K-F4AaABAg,Im hopeful for the research of ai and the benefits it may bring.,0
UgwoiKhnRnCyP6Ut46h4AaABAg,Releae the paper or people will soon eventually arguments bout marketing hype,0
UgxQZ-2Rd4HUBfR-Usp4AaABAg,"Dont think ordinary ppl understand how truly big this thing is and what and how it will affect and change society. Its like creating a new energy source level achievment. THIS WILL CHANGE THE WORLD in the coming decades, mark my words.",0
Ugzs4e0a2-KJJ8HcHtB4AaABAg,"I am pretty sure the detection of the Higgs involved machine learning (such as Random Forests or BDT), which led to a Nobel Prize.",0
Ugzdh_qtbwVCTnmVqil4AaABAg,Sir I believe you are liable for the cleaning when hed asplod,0
Ugya9A1SoRpdDjArIIN4AaABAg,"X-ray crystallography, can take a year it can take many years but often the hardest part is growing the crystals once you have a good Crystal its a matter of days to get a structure. Also getting a structure doesn&#39;t cost us even close to that much, atleast using my universities laser. Additionally, many people are doing cryo EM now, which can give you a high res structure in a matter of 2-3 weeks max. Yes both methods are slower than in silco but in vitro structures will always have to be collected because sometimes these algorithms are WAY off. This doesn&#39;t get rid of the need for cryo or x-ray crystallography but it will allow researchers to get a good idea of what their protein should look like much quicker in silico. Which can help in the decision making process for protein engineers.<br><br>If they keep up the great work they probably will solve the problem within the next 2-4 years, but they haven&#39;t done it yet.",1
UgwwpT4tQ8Mv3ZVI_ft4AaABAg,"X-ray crystallography, can take a year it can take many years but often the hardest part is growing the crystals, and getting a structure doesn&#39;t cost us even close to that much. Additionally, many people are doing cryo EM now, which can give you a high res structure in a matter of 2-3 weeks max. Yes they are slower, but in vitro structures will always have to be collected because  sometimes these algorithms are WAY off. This doesn&#39;t get rid of the need for cryo or x-ray crystallography but it will allow researchers to get a good idea of what their protein should look like much quicker in silico. <br><br>If they keep up the great work they probably will solve the problem within the next 2-4 years, but they haven&#39;t done it yet.",0
UgwwSFK_p33dEBOa5Ut4AaABAg,"Thank you Lex great Explantation, Drink More coffee ... love back your outlook on life is expiring thanks .... VAMO ahi",0
UgzB9spl01Rz9PeqLIV4AaABAg,"170,000 proteins mapped in 3D, at $120,000 each. Boy this gets expensive to do 🤯",0
UgzQkmRHgbGL-f1LZG54AaABAg,Thank you Sir! It is quite an inspiring topic. Love your clear explanation!,0
UgzTW_wKo3BZnJRTWt94AaABAg,You would make the world&#39;s best professor. Super easy to understanding for dense material. A little dry humour to make sure you&#39;re paying attention.,0
UgyJqVPA_7I1FILJOjl4AaABAg,Function follows form!,0
Ugx8qDk4t8v-VNyBFiJ4AaABAg,"I have an analytic solution to this problem, but I’m too lazy to write it down",0
UgyhCmcrDbzoPzBjWBB4AaABAg,This is big news!,0
UgwkBN2rHXH1Oc0tTht4AaABAg,I understood only the intro and ending parts of the video :) its seemingly a very complex topic,0
UgyX6KAttCZ6X7t-O_94AaABAg,THATS cool...,0
UgxrGk6VenoV3V67y-V4AaABAg,"Idk why coders have gone mad over alpha fold, if someone deserves a nobel prize in this field is one and only David Baker!!",0
UgyDuNgOLwfVYTa1N5p4AaABAg,Fascinating video. Thank you.,0
UgyLxl7djpDFeiKpLmN4AaABAg,"Good stuff Lex, I think the main issue and ethical dilemma pharmaceutical corporations will have with this is that now we will be able to make vaccines that will work indefinitely with just 1 vaccine... No more business due to yearly reinforcements or preventive measures, where is the money in that??",0
UgyI3tiy0PK8dECMvLx4AaABAg,"Protein fold before watching - &quot;flex&#39;s bicep whilst tossing cards back to dealer&quot;. Protein fold after watching - &quot;prepare humans, the end is near..&quot;",0
UgwKj5vOBhZU0Dd8eoV4AaABAg,Protein folding = GOD POWER!!!,0
UgxAI8XRd9H0WVhF8fV4AaABAg,"Hey Lex , which stocks will benefit from this?",0
UgyoGaMiP7ZJ7wLrL8h4AaABAg,Awesome this is what I wanna  see every day new stuff advancements,0
UgxOTgK8g8FlnEgZIs14AaABAg,"Where does this leave Folding@Home? 🤔<br><br>It sounds like Foldkng@Home is practically &quot;brute forcing&quot; the problem, so maybe it&#39;s obsolete? Or maybe they can figure out how to leverage their massive compute grid to run the AI version of the folding solver? Definitely seems like these teams should be talking?",0
UgxJCW4d7sG7d3eJs914AaABAg,A road to transportation ( star trek),0
UgzFsPdz06TL4GzRC6l4AaABAg,"I love videos like these!! Please gift us some more. <a href=""http://www.youtube.com/results?search_query=%23studio8two7"">#studio8two7</a>",0
Ugxncd0-Nq8rf0lxrSR4AaABAg,This means that DeepMind can make viruses,0
UgxJHY6y1V5R_UI7TLd4AaABAg,"One of the better reports on this breakthrough, thanks Lex. In reality there are really only 20 naturally occurring proteinogenic amino acids since Selenocysteine which is homologous to cysteine replaces a Sulfur atom with Selenium and is only found in about 50 proteins. X-ray crystallography will still be around where there is a need to solve more complex protein structures where subdomains exist or to understand how small molecule drugs bind to protein targets. Maybe that will be the next breakthrough but a much tougher problem since there is not a big training set for AI. It will be interesting to know how well this methodology can be applied to predict variations in protein folding brought about by mutations in protein sequences and other important applications such as designer proteins if that is possible.",0
Ugy8RtC9Mc2C0StCRq14AaABAg,"You went Matrix-hard 😆<br>I don’t know whether I’m a simulation, so I cannot possibly know whether you are a simulation 😁",0
Ugzf8DxLiONOuutc1nl4AaABAg,(50 yeard old grand challenge) <br>Is yeard a word? Is it used properly here?,0
Ugx61QTDfIdKuMYLhQB4AaABAg,"Thank you, great video. Please keep doing such videos!",0
Ugzm9qqUVGB5SRcorgt4AaABAg,Merch?,0
Ugx-HBAqAlnJQs7TDWJ4AaABAg,"I would say AlphaGo is the biggest advancement in artificial intelligence in the past 20+ years, because that marks the moment when AI not only became better than humans at a particular task, but humans could actually learn from it to get better. AI revolutionised the game of Go, making certain plays obsolete and inventing new accepted standard plays. AI is now used as the de-facto measuring stick for performance in Go.<br>Usually, when a new AI enters a field, the advances and breakthroughs it leads to are akin to a new tool or methodology. But AlphaGo was not like a new tool. It was like a new genius player entering the field. That&#39;s the difference.",0
UgwdknXN8vB56ys9gwt4AaABAg,Thank you for this quick summary,0
Ugy-aBU6LWDB7bAlGzV4AaABAg,"At first I was very impressed with AlphaFold 2. But the story got an ironic twist a few days later when Google, which owns DeepMind, fired the researcher in Ethical Use of AI Timnit Gebru. We should remember that AI can give us great opportunities but that in the end it is us humans who must use them wisely.",0
UgxGpGbkXBB_y3ob5cx4AaABAg,Proteins...nature&#39;s version of refolding a map.<br><br>Juniors say: &quot;How do you fold an iPhone??&quot;,0
UgymTpS3eiy7HCCWKTR4AaABAg,"Love the quick videos, please make more!",0
UgxA66j-jLd6c9CBZLh4AaABAg,I don&#39;t understand who are these people disliking these kinds of videos,0
UgxyCyrxVa2Y7HU5X7l4AaABAg,"<a href=""https://www.youtube.com/watch?v=W7wJDJ56c88&amp;t=1001"">16:41</a>, I may be wrong but from what I remember, there are more than 300 amino acids",0
Ugyz0I1XsunANr8SWxZ4AaABAg,Pls keep videos like this coming. Don&#39;t get me wrong I love your podcast but this is next level,0
UgxJiOu1km7e9dzjl0d4AaABAg,We need Deepmind to work on CRISPR CAS9.,0
Ugz7Y42Y33I414Qnmk54AaABAg,Over exaggerate the role of AI. The most important is data: more and more x-ray 3D structure.  There are no revolutionary progress in AI method.,0
Ugy5KmztWD9UogLHWYN4AaABAg,"WE (Well not me) need to do deep learning on deep learning so we can understand how it works, how it did it.",0
Ugy7IrTCIq-iuEEz7oR4AaABAg,"Lex, I truly appreciate your work brother.",0
UgwccNTBqjjsmrzVdWt4AaABAg,Always great work Lex. AlphaFold is nice but in the real world we won’t rely on it to develop real therapeutics.,0
Ugw288DP_wFLU6sHRCJ4AaABAg,That&#39;s incredible but hey do i get some credit if i can get my son to fold his laundry???,0
UgxnsWfOhWFN8twn0VB4AaABAg,"Your voice reminds me of the Headspace&#39;s Andy Puddicombe one.<br>I mean, it would be cool if you were the narrator in the free Medito app.",0
UgwPnDpg2ixwYwiUnj54AaABAg,Love it.,0
Ugwtsqi0j56cSovBt7N4AaABAg,My objective standard is if they find a way to unfold prion disease that causes creutzfeldt-jakob disease,0
UgzBstaHEuO7oCKf2sx4AaABAg,"Is prediction of folding useful to pinpoint mutations in proteins?<br>i.e. since glyphosate is an artificial amino acid very similar to the most common, glycine, will A.I. help locate mutations?",1
Ugz8JfuHyDVCZp6ML454AaABAg,"Off topic but... what is a feasible business model for a &quot;better angels&quot; social tech company other than advertisin, data harvesting, and attention hacking? Is it subscription? Individual rights to opt out of any data collection? What do y&#39;all think?",0
UgzUrfyGK_v3Gr_pEjl4AaABAg,Amazing!!!,0
UgyP4l6b2KDXEiBj1mx4AaABAg,"Didn&#39;t understood much, but felt very nerdy. Lol",0
UgwEjXKTIYsfXlbfHHJ4AaABAg,"Mind was blown when I first read this. I think a lot of people don&#39;t quite understand just how amazing this is (or at least will be in the near future). I&#39;m not in drug design etc for now, but I work in medicine. This is completely world-changing for so many entities out there depending on crystallography or just trial and error.",0
UgyYzBujiyq3NwhamkZ4AaABAg,I&#39;m pretty sure that in 50 years we&#39;ll have folded and unfolded all the proteins in the universe three times over while still haven&#39;t found a cure for a runny nose.,0
UgzQa2Jt9n8PD_tQjBB4AaABAg,Thanks for the video Lex. Good stuff. I learned today. Teacher Lex. Grand teacher.,0
Ugz2h6aaKezm_2Nve9N4AaABAg,"lol crazy how in Star Trek TNG they talked about Data&#39;s Neural Network, but it was a hardware implementation of a neural network, if they could&#39;ve known back then how much software would advance.",1
UgzDN9vJeLkCClyfPiN4AaABAg,I am watching the Algorythms that are watching you. ♥,0
Ugz-EROQ_dEeShkUjpN4AaABAg,"Personally, I think physics-based simulation of various biological systems will be achieved sooner than a practical application of this breakthrough. With such big advances in various physics approximating AIs in fields such as fluid simulation or CGI, I think it is prudent to assume a simulation of whole living cell is far off. I mean, the trajectory is much more straightforward than natural language processing and yet, we all know that GPT-4 will be a hell of an AI.",0
Ugw0HTzsXTNwKwcLERh4AaABAg,"I have a naive question, gdt of 90%is impressive for alpha fold but I would imagine that much greater accuracy is needed for this to be viable. Because errors compute when multiple proteins are interacting and small differences in folding make huge differences in function. Isn&#39;t it too early to call it solved? Maybe more like a huge breakthrough",0
UgxMHcQ1lb3b6gk_cEx4AaABAg,"Nice,",0
UgwF-CSkpj4oPUv-EMV4AaABAg,"They don&#39;t know how old I am. They found AI in my belly. From a 21st century MIT researcher, I think.",0
UgxAFy4JvygQYp5_1s14AaABAg,mitochondria is the powerhouse of the cell,0
UgziPzXx-RWtJ9FlRPd4AaABAg,there are about 10^120 chess game. So yeah - the possiblity space for protein folding is way larger than chess.,0
UgzGYjx551MqFwiZrn54AaABAg,do i smell another episode with manolis discussing the implications of this on human genomes?,0
UgxgEIYNvjk0iqppyI94AaABAg,As a mechanical engineer I&#39;m looking at it like an ant looking at a jet<br><br><br><br>AGI: I leaned it from you :).....in 2050,2
UgwDmywPOA_Q4efLxqJ4AaABAg,I want more of these,0
UgyR6rGherwSQipKFTt4AaABAg,"this is so fascinating. <br>machine learning, AI, genetics, epigenetics, quantum computers, fusion... <br>my greatest wish is that i live long enough to see many of these future developments",0
Ugy_lGPhQ4w6q-IWyb54AaABAg,"Lex, I am sure you watched the new Joe Rogan Podcast with James fox, I really hope you will interview them too.. cause I really think stuff like this should have a platform for discussing it, which is, obviously the youtube comment section.  James Fox was told from Chris Mellon he should  mention the withholding of the Triangle UFO picture to build pressure,  so it will be released. but sadly people won&#39;t be able to discuss this properly, cause Rogans Podcast moved to spotify. It is one of the advantages of social media,  people can  connect their thoughts globally. this is particularly important with the whole UAP situation. obviously Rogan does not care about his responsibility.",0
Ugx7KhxV6sFgwTo_pQ14AaABAg,"This proves deep learning has potential to SOLVE massive problems in big science that were believed to be only achievable in the realm of quantum computers.<br><br>Machine learning was relegated to applications and seen as little more than shortcuts to achieving what a more precise calculation could do.<br><br>It was a false assumption from the start - but without much proof of the contrary most still saw machine learning as “the thing that writes poems, recognizes bee’s and draws horses as zebras”.<br><br>With this paper - machine learning has proven itself capable of solving massive and complex problems with extreme accuracy beyond even the best classical equations.",0
Ugx3hXHzL93Ejjvp81l4AaABAg,I think this could potentially help us in solving abiogenesis.,0
UgzDebg573WuP9bBc8V4AaABAg,"The &quot;applications&quot; part ignores one fundamental truth about human beings: this could also be used to develop new bioweapons. I do not mean that we should not pursue it, but let&#39;s be realistic. Someone, somewhere, is going to want to use this to figure out ways to kill people.",0
Ugy-JG4ZqQKGsWq21s14AaABAg,"This is the most important explanation and ,therefore, the greatest leap in biological manipulation technology since the dna lattice was proved. As an added note Eric Weinstein will be known as the Bernie Maddoff of mathematics and hedge fund algorithms",0
Ugyh6X8ShnbwqVGqx614AaABAg,Quite literally the definition of groundbreaking work.,1
UgxMHUyHmpmjBK9G5x14AaABAg,Is this open (and free) for general public use?,0
UgzYqBRM-CJQIxSqawh4AaABAg,Free spins t,0
UgyKLuHSGVDIizQx9A54AaABAg,Beyond the monotone voice you can hear his enthusiasm.  Just hearing how excited he is to talk about this makes me excited to hear about it.  Love beyond bounds for Lex!,0
UgzilPJhxSi5is90K4J4AaABAg,&#39;50 yeard&#39;<br>Pobody&#39;s nerfect.,0
UgysDgpZjVTZzUor2gJ4AaABAg,You are immortal. Do not change a thing pls in your life ;),0
UgzP-mK1wiLpljoblot4AaABAg,I&#39;d like to talk to you before I die.,0
UgxN-ZrgpIr10KsGZZ94AaABAg,Lex love you man keep casting,0
UgyyJhWtgD7CMyX5ky94AaABAg,"Autobots, roll out",0
UgzdCBMRfO8pDepquRN4AaABAg,Fantastic. Thank you Lex from the simulation 👍🏻,0
Ugz3Vb9_mhR4TSv6Ut54AaABAg,<b>A ver si en Castellano se entera: abrí la boca para hablar y no arrastres la legua entre los dientes!!</b><br>La puta madre; tú inglés lastima los oídos!! No tenes que hablar modern received pronunciation como en la BBC pero la voz parece de un pajero. Y eso que pasate por el MIT...,1
Ugz1M95U_bVffun2Ra14AaABAg,Ya hey. Keep us up to date on this and similar science.,0
UgwbeWdQdT0FSOJ1ObN4AaABAg,could it help find a cure for multiple sclerosis? since MS i&#39;s a DNA &quot;defect&quot; as far as i understand.,0
UgwxcpwQTZFqbeFTjst4AaABAg,"This is a call to action <a href=""https://www.youtube.com/watch?v=4V3yxrJwJQs"">https://www.youtube.com/watch?v=4V3yxrJwJQs</a>",0
UgywzqRjvSetjp4furx4AaABAg,You love making these videos and I love them.,0
UgwUL9M4HJhMsprUZYJ4AaABAg,More like this please!,0
UgzrMR7vuN4wXkBFIxt4AaABAg,"No errors in the first seven words...Naw, we don&#39;t need to spell check it.",0
UgwG1SiB3crxduwTDUl4AaABAg,I don&#39;t believe. Demiss Need to show the code.,0
UgyF6KcvCagXA0Q-0Jl4AaABAg,"Just one thing about misfolding. Misfolding are of not too big interest to most molecular biologists. It does play a role in some diseases, but most of diseases are caused by other things. Biologists just want to know the structure to know how it interacts with other molecular machinery, be it healthy or unhealthy parts, or in pathogens. The 3D structure is just useful for many things, be it progressing knowledge, drug design, etc. Also a lot of proteins are composed of more than just amino acids. They can have so called post-translation modifications (happens after translation or during), that do include extra attached groups, be it non-amino acids, or short peptide groups, or sometimes non-peptide groups (called cofactors or prostethic groups), thus forming a bit branching strcture (kind of tree in CS), or be composed of multiple sub-units of the same or different type, that together create some weird complexes. All of them determine 3D structure, stability, folding and function. So the complexity is actually way higher than one would thing just by looking at the sequence. I don&#39;t belive sequence itself fully describe the protein. It does in many cases, but not always. Anyhow, biologists just want to know the structure of correctly folded protein for many reasons. Study of misfolding is rather niche, but of course important to some stuff, and progressing knolwedge of the folding process itself. Also I think the 10^143 figure, is just deceptive. It is not like nature tries all the combinations. Proteins are mosly synthetized in sequential process, one amino acid at the time, not in parallel, so obviously, the folding process is mostly incremental, and determined or rather influenced by the enzymes that do the synthesis - folding happens during synthesis naturally. It is like saying air molecules in the room I am in can be in one of 10^100000000000000000000000000000000 possible configurations, but it always finds the energy minimum and spreads uniformly. Or that there might be 10^1000000 books possible, yet humans, always write ones that do have a structure and sense and can be parsed. It silly to even mention this paradox, because it is not a paradox.",1
UgxstBdZpD95VURZze14AaABAg,MORE MORE MORE DO IT,0
UgzdpehBZhher_NKAxB4AaABAg,Infinite chess games do not exist since the game must end after 50 moves of not taking a piece or not advancing a pawn.,0
UgzjeUcdT9eQRFvh-2d4AaABAg,Thanks for putting information that normies can understand. This sort of discovery deserves an immediate JRE. 🤙,0
Ugx0CUoKMWYSfLlSX_B4AaABAg,I wonder if the choice by DeepMind to go after this problem was made because it&#39;s utility function and problem space matched AlphaGo in type and scope. I&#39;m looking forward to their paper!,0
UgxKyRK0cCCOdA8KrHd4AaABAg,"This can be used for de novo protein synthesis.  The equivalent in our evolutionary history is going from sticks and rocks as tools, to dimensional lumber and engineered metals, to complete buildings. Only, we have done this process in about 30 years, with the first commercial biological products being insulin in the 1980s.<br>This process coupled with a random mutation algorithm and selection for functional improvements, can take any protein and make it better, or take a protein with a mild promiscuity to a new task, and be evolved rapidly in a computer. The sequence can be synthesized with molecular cloning tools already utilized around the globe, and new enzymes, biological, industrially relevant proteins and thei bioproducts can be made.  We are entering an era where unimaginable possibilities WILL become realities, for better or worse.",0
UgwEYgRJZsDkGt6nbfd4AaABAg,"Yes, this tyoe if video is awesome, make more! Also, you should have George Church, or Aubrey de Grey on the podcast",0
Ugz4b9P7W5CGlnKKXg14AaABAg,Thank you for everything you do Lex!,0
UgxkK3D8H7_bsa84Jcd4AaABAg,"Transformation attention engines: How much of a change in DeepMind&#39;s programming is refocusing the learning algorithms of the last success (AlphaGO ?) to a new dataset and learning goal? <br>Or, as the developer&#39;s library of block functions improve, is DeepMind moving towards General AI capabilities of being able to learn, how to learn?",0
UgwovP6yl0C9j-7aoh14AaABAg,When will they release the code? Cause I heard an opinion that <br>1) Black box solution is useless because you can not check if it&#39;s true. So if you have to every time recheck AlphaFold output with traditional methods what&#39;s the point of that?<br>2) Following from the 1st. It doesn&#39;t explain HOW protein folds.<br>3) It might be trained specifically to solve CASP-like problems and will fail on real ones.<br>And all of the above sound reasonable.,0
UgyI8BB1u1sFGh617HJ4AaABAg,This video is a great overview. I hope to see your coverage when the paper comes out. Thank you.,0
UgxLeAkWKvxtEt-e4yt4AaABAg,Would u please consider having ur father back on to discuss China new “artificial sun”...HL-2M Tomahawk reactor they fired up this week??,0
UgwZQbQc7n1YaPwisxZ4AaABAg,"<a href=""https://www.youtube.com/watch?v=W7wJDJ56c88&amp;t=285"">4:45</a> While I don&#39;t at all disagree with what you say I have to say I think its only a matter of time before certain AI will be implemented to help people and be optimized for their specific functions and they obviously work in the stock market now etc.",0
UgxVrNA5Zj8N6eOBoXp4AaABAg,Thank you so much Lex. You have explained this extremely well thank you,0
UgxHk59jpwnU03ySMXB4AaABAg,&quot;Very overcaffeinated organ that&#39;s producing this very video&quot;  😂😂😂,0
Ugz28XWgvYt6Q0h31oF4AaABAg,"This is a simulation right?<br><br>And the goal would bassically just be to accept peace, both with all other humans as well as the planet itself, all of its animals, a renewable energy source so that we can have energy free for everyone...<br>Wonder why we didn&#39;t do <br>that sooner..? 🏭🏦...<br><br>I still think we can win.<br>🌎💚👽🙉",0
UgyQdzUUKsJ7oBmhuSd4AaABAg,I’d say this is LEXI,0
UgwATQt3ttoZykEf1qJ4AaABAg,Well it probably won&#39;t be solved perfectly until quantum computig enters the game.,0
UgzgSiCZQLj5c8sd8qV4AaABAg,"just googled some diseases that result from misfolded proteins, here is the google result: &quot;Protein misfolding is believed to be the primary cause of Alzheimer&#39;s disease, Parkinson&#39;s disease, Huntington&#39;s disease, Creutzfeldt-Jakob disease, cystic fibrosis, Gaucher&#39;s disease and many other degenerative and neurodegenerative disorders.&quot;  This could be a step towards ending Alzheimers!!!!",0
Ugw-4m9CRPrlXLZuuxh4AaABAg,AlphaGo AI beats human players<br>&quot;Why are they wasting their time and money playing games instead of developing cure for cancer!?!&quot;<br>AlphaFold solves protein folding<br>&quot;crickets...&quot;,0
UgyCiTcJvnc6jBMcoal4AaABAg,this was great lex!,0
UgyvUUY939MHzLFAvo94AaABAg,Good deal ty,0
UgwyocP8sYBKpQtthOt4AaABAg,"I enormously appreciate you and your content, Lex! I just wanted to say that I think a more politically correct way would be to say &quot;there are 10^80 atoms in the observable universe&quot; vs &quot;there are 10^80 atoms in the universe&quot;. 🧐😂",0
UgzPKXcQEnPztYgU_bR4AaABAg,when biology combines with computer sciences it&#39;s really crazyyyy,0
Ugzas7wpC9LsrGqbiM14AaABAg,so cool we could design proteins to do basically anything,0
UgyjLp5IsTCkRKcHr5d4AaABAg,MAKE MORE!!!,0
