CommentID,Comment,LikeCount
UgwAQfDbcL908MfgekB4AaABAg,Can anyone tell me why Lex enjoys such a cult following ?,0
Ugy-Z-AZQVwQKMBr8Sd4AaABAg,"This might have been the first step in simulating intelligence and consciousness.....  why’d you have to bring that point up, now I can’t stop thinking about it",0
UgzCOLsuv19Ua_UDfZB4AaABAg,"As someone who knows very little about whether/how this group of algorithms can be said to “learn” features in the training data, do we think it’s possible, in some sense, that it is learning to incorporate environmental folding cues (such as chaperones)? Or are protein conformations that are known to require such external cues not part of the challenge?",0
Ugxs3uBNPHlVxsbNACJ4AaABAg,"Lex i am big fan. I am also programmer, right now doing masters. Anytips on improving overall programming skills no matter the language or framework .",0
UgxtKp6F5ZdKhGKclmx4AaABAg,"As a bioinformatision, I&#39;m hyped",1
UgzOfIWt__AcZKaX6HB4AaABAg,Hi I am a biochemist. I have great interest in protein and nucleic acid folding but I did not really understand your explanation of what AlphaFold2 is. Is it like molecular dynamics but more accurate? Are you saying that it can predict protein structure from an amino acid sequence?,0
Ugw9cs9OXP8ygwELRTx4AaABAg,Thanks Lex Fridman,0
Ugwt2qWbaSJ3NheOeu94AaABAg,👍,0
UgyOk51sfMk5Xah2Ip94AaABAg,"I studied Biomedical Science and masters in Regenerative medicine and Nanotechnology and I&#39;m starting to wonder, if AI is becoming so powerful why bother with anything else. I mean it&#39;s starting to seem that AI is gone solve most of our problems sooner than we thought. So why bother, just become an AI expert and you&#39;re done, you can solve anything eventually",1
UgxZf9qyaPHoqgnxDXZ4AaABAg,"Thank you for being an educator, Lex",0
Ugxbg3DGXgMw8AX0yUx4AaABAg,"Make more, Lex. Really helpful for a lay listener",0
UgxylhRHKVzVHj2M0bR4AaABAg,"Love these kinds of videos Lex, keep them coming please!",1
UgzWuQ3LYoLVuN5r1p54AaABAg,Eureka! The genie is out of the box. The Greatest Awakening and the end is Great!  Thanks 🙏🏿,0
UgwobQi2BOjzJMl7rz14AaABAg,Awesome video!,0
UgzxZ1rNGz4jE8BzP_V4AaABAg,The part of being in a simulation freaked me out and you&#39;ll never part gave me an unusual calm!,0
Ugz4CC8582txQ7wBAgh4AaABAg,It’s a magnificent triumph of it-from-bit.,0
Ugz4tVxJvrlmMLj5S4Z4AaABAg,"Enjoyable, great, and exciting videos, some of the best things the internet brought to us.",1
UgwI8Xx8uhJka9Stcjt4AaABAg,More short fun mindblowing videos,0
UgwdZDtCWx7r_nM8fgd4AaABAg,"But, as far as I know, Boston Dynamics is not using ML for controlling their robots.",0
UgyKmyvPH7WasM_neXp4AaABAg,love the vid! keep it up!,0
Ugw-bEvDPzQ5yNohWUt4AaABAg,"Make more videos like these, please!",0
Ugzz4NQD2n8aX69B1R14AaABAg,That was great Lex,0
UgwdcLYH-18--W6ACR54AaABAg,"<a href=""https://www.youtube.com/watch?v=W7wJDJ56c88&amp;t=886"">14:46</a> Now that you say something about it, your speech patterns are eerily similar to Kurzweil. Perhaps a younger model...🧐",0
UgzKeof3aFKu-AuozkN4AaABAg,Demis Hassabis on the podcast ??? Or someone from the team? Would be aaamaaazing!!!,0
Ugz6ZBP9ZZUD4-dWQDJ4AaABAg,"Look, man, I don&#39;t care what it is; just give me a collection of sequences, some GPU’s and I’ll compute the prediction. — Programmer",0
UgxYuRSEHSGhuzQzRA54AaABAg,"I never know whats going on in lex&#39;s podcasts, litterally never, but I keep showing up!!",0
Ugywlffqoi3UVKEnuvF4AaABAg,Thank you,0
UgzRZJBUWgzr0vqImOp4AaABAg,"This quick videos are great, please keep making them.",0
UgxwYoZ222nxNqTimL94AaABAg,There are 20 naturally occurring aminoacids... Not 21,0
UgwZz3Jqqn5cU1cDJXd4AaABAg,These short videos are definitely useful Lex,0
UgyfmFNX_gxALiVjrqR4AaABAg,Lex go!,0
UgytN-1kmPa5hn7XA1J4AaABAg,"Damn, what a time to be alive!<br>Also, huge thanks to you Lex, for all the work you do and such videos especially. I was just thinking about learning more about AlphaFold and protein folding in general when I read the news.",0
UgzNTTBkC2SQcBKQlpB4AaABAg,"Don&#39;t get me wrong, but, where&#39;s Levinthal&#39;s paradox works in the CRISPR amino acids detraction?",0
UgxiMt6Qf1gszWIsKR14AaABAg,It has not solved protein folding. It&#39;s made it faster to process a select few of proteins,0
UgyApZZrSs0AK_5-0SJ4AaABAg,Wondering video to learn protein folding for a computer scientist. Couldn&#39;t find time to understand the problems in biology which is up and coming.,0
UgzKmE1GxtyDd5CJBHh4AaABAg,"This I is what I was waiting for ❤️ thanks Lex , you are amazing. Waiting for your next video with self driving car model test and you playing a guitar. <br>How do you manage all these things at same time is amazing. Keep rocking and keep hustling.🔥🔥🔥🔥",1
UgzQziuECKIdwFH8Q694AaABAg,"As a bioinformatician who is deeply interested in ML, this is one of the most exciting and good news. I must admit I am hyped! There is still a long way to go though, since drug design is mostly dependent on solving the docking problem, which is many orders of magnitude harder than protein folding. Nonetheless, this beast of a model truly is a tremendous acomplishmend, transforming the field for sure!",0
UgwqKFPh7m52FELSo6V4AaABAg,"One who can crack jokes while taking about AI, ML , actually deserves a Nobel 😁😁",0
Ugw4Wf7d5tKPvSrTSJh4AaABAg,Lex would be good at commenting on recent deep learning papers.,1
Ugw2OSxBPMG19NbCwpV4AaABAg,Fantastic Lex! You can really tell your excitement or excess of coffee! 😬 from the vid,2
UgzGqqY-RqqQmq23oPd4AaABAg,Yeah make more of these type of videos if you enjoy it. Maybe like videos on &quot;state of the art&quot; happenings in machine learning would be interesting. Thx Mr Lex,1
UgzmzFqAHC0gmgVQQUZ4AaABAg,Can you get Demis Hassabis on your Podcast? That would be awesome,1
UgxIhgfPIAcrBWwLF694AaABAg,I would love to get my hands on Alphafold2 for my research someday. Please keep making more videos about this! Thank you Lex.,0
UgyEKKSUKj55rLKOeOp4AaABAg,Thank you for this video. Really nice work. Definitely would love to see more of such kind of short educational videos.,1
UgwPorz8agGg1I5LHVB4AaABAg,Make more! :),1
UgyRu_lvh1SxxSn5LrF4AaABAg,Next podcast idea: Interview with one of the team members of the AlphaFold project.,61
UgyefJ2by6cQmwRasm14AaABAg,and this is just the beginning :)  ....,0
Ugw_F5IHR9hWRuEOMrl4AaABAg,"Lex all of this Is very cool, please invite scientists from deepmind to your podcast It would be very interesting.",2
UgztLXs2r6iFuWg0C1h4AaABAg,Crasy times has become wilder!,0
UgwO8SbXneYTgvgBOAl4AaABAg,Keep  doing this kind of videos. They are amazing!,1
Ugytfik-PwHQh-hhIrt4AaABAg,Would love to hear more about this and AI in general in future podcasts.,0
UgwJw0iXMZu43sluC654AaABAg,Great video +1 vote for more of the short videos,0
UgwRxwt7c5xmKxK1Q9J4AaABAg,My 4 year old has to carry an epi pen everywhere he goes. Hopefully this can lead to gene therapies soon. Well explained. Thanks Lex!,1
Ugz-wUb_ZBEXeq-hdAF4AaABAg,"This is fascinating, I am a sf fan and I approve this :)",0
UgwPBQWlStwXOq-8KNR4AaABAg,"Structure is related to function, that is all you need to know. Huge implications",2
UgwiZEvoS_d9Y0a-b4l4AaABAg,"With transformers becoming the new paradigm, what do you make of Aurélien Géron’s work on Capsule Networks?  Maybe that would be a great future interview, I haven’t seen much on that space of the field in a while :)",0
UgysN8AMhnCHwe90FwF4AaABAg,Bye bye covnet,0
UgxEq5RYXngIInZQH5p4AaABAg,"Yes, do more!",0
Ugw0rnNRB21O5HtarnZ4AaABAg,when i feel like giving up i go out and its there and its on and we sync up and i get to dance with technology it touches my soul and for a moment the world opens up and we have this dance we part ways  and then your here and i know it was real i know its still worth it till the next dance thank you ....,0
UgwdsS5SJ-KtaOJGdVd4AaABAg,GPT and its successors will unlock more scientific sorcery in our lifetime. Quantum Machine Learning will make humans beg to transfer our consciousness into a superior substrate.,0
UgwL-NvwSijmBzVRAX14AaABAg,"Make more, these quick videos are Awesome.",0
UgxWa6pADr2XV7hXroF4AaABAg,Thank you lex just got in and landed on this thank you for letting me know my walk was productive muah....,0
UgzGLDP06tc1BtHe7SN4AaABAg,"The &quot;Protein Folding Problem&quot; is no closer to being totally solved than Cold Fusion is to powering our homes. It appears what AlphaFold2 has been able to accomplish is a rapid and accurate simulation of a final conformational state of an enzyme protein CASP14. This is no easy feat, but the hype around this accomplishment misses all the protein folding dynamics, intermediate states, and binding sites and exploring ion channels (for pharmaceuticals to attach to) a protein actually has to go through, to get to the final state. This is still in the realm of long running simulations like you see on distributed computing projects such as Folding@home (or run on massive supercomputers). <a href=""http://www.youtube.com/results?search_query=%23curecoin"">#Curecoin</a> is actually a cryptocurrency valued in the computational work required in simulating FULL protein folding dynamics. It&#39;s a prototype for a Citizen Science UBI based on COVID-19, Cancer, Alzheimer&#39;s, Parkinson&#39;s, Ebola, HIV, Influenza, anti-bacterial resistance, and even exobiology RESEARCH. A hybrid organization with a 501c3 sponsorship - a charity inside a social entrepreneurship package seemingly ignored for YEARS by the Mark Cuban&#39;s and Jack Dorsey&#39;s of the world - see also, &quot;What is CureCoin&quot; on Youtube. Cheers Lex - really appreciate your channel.",1
UgzCmfU8-xN77ivo96J4AaABAg,I love the quick video format lex! Perfect to squeeze in before work 😃,0
UgyB1Cp6W53LozkJa8x4AaABAg,"We can get longevity escape velocity out of that. New challenges for a society, imagine an immortal Putin, just imagine.",0
UgzH9x-h6TUi-DgXK454AaABAg,This was awesome,0
UgxHQoIyaqtOom1BzWV4AaABAg,"thank you for sharing this....i have only seen it pop up 2 times since it happened in news and feeds so yay....i keep cheering this shit on and been helping contribute.....like 10 yrs ago I started using Folding@home on PS3 and i loved the program interface they had for that with the interactive globe and news and also the 3D image of the actual protein appearing bit by bit (they are so wiggly lmao) as you were lending your resources to the cause.... 🥂 cheers..... I&#39;m happy to see someone else nerding out over such an underreported and underappreciated feat.......EEEEEEEEEEEE 😜 when the bizarre events being heavily pushed thus year erupted onto the scene like a virus, i immediately was like oh it&#39;s a protein they need to figure out well then good we got this shiiiit and saw a thread somewhere confirming work on it so i was like woooopwoooop but then well....🙄you knowwww....greeeed....and whatever....but my spirits are lifted after this news....HEY YOU.....much love and peace and respect and thanks for sharing your thoughts always.....you are a very beautiful sanctuary for my head and heart to find peace for a while in this existence and i appreciate your work/art/content",0
Ugw2UGyXiQNzCkjFchh4AaABAg,Thx bro,0
UgwyJTjcljcHc_1x28J4AaABAg,Love these mini-lectures. Your slides are next-level,1
UgxTpUzIvUPHeZCMBkF4AaABAg,You are awesome bro <br>I love you ❤️,1
UgwIfzXw7TyqzbMeIq54AaABAg,Thank you,0
Ugz-47ZnEzI-E2D006l4AaABAg,this is a great summary.  thank you,1
Ugz8le-1tNAdtukfWOJ4AaABAg,We need an AlphaQuantumGravity asap.,0
UgxV5v6Yr0DQNPKDyfl4AaABAg,"Keep doing these Lex, they are so well done and explain a ton of good info in a reasonable amount of time! I love how the short term and long term implications are broken down nicely. I love the slide deck design too.",1
UgzL28u7WnhOZOVH0WB4AaABAg,That was a great explanation of protein folding and alphafold2. Please make another video explaining alphafold2 once the paper releases,2
UgzmCdB_3h9llmrHDFZ4AaABAg,"Thanks a lot, this achievement is &quot;hope&quot; to me.<br><br>Anyway, we can&#39;t be sure whose this achivement belong to. In my humble opinion, this achievement happened because efforst of many people and life forms and should be credited and ackowledged. Including you, Lex. Thank you!<br><br>At least, until we really how this Artificial Intelligence system/algorithm works right?<br><br>Thank you for whoever make efforts and make this achievement happened &quot;now&quot;, after I just listened that Covid might strike again here in Thailand.<br><br>Stay healthy, use protections and be safe everyone :)<br><br>With love,<br>Anan",0
Ugy3lHyJAy-uskZhDcZ4AaABAg,Great video,0
UgxOHg1bQlPNZDS1MHp4AaABAg,Thank you,0
UgwcBya5OwfQk_W-Uk14AaABAg,"(<a href=""https://www.youtube.com/watch?v=W7wJDJ56c88&amp;t=318"">5:18</a>) There are many non-canonical amino acids. However, I think that there are 20 &quot;regular/canonical&quot; amino acids.",0
Ugybuac3fCUx6jizBjd4AaABAg,Loving the shorter videos! Please consider making one about attention mechanisms.,0
UgxniyCuPNidd60eMe14AaABAg,Would be super cool if David Silver did second appearance on the podcast to talk about Alphafold.,0
UgyvWXlP4paOO52LqUB4AaABAg,"thank you, love you",0
UgxzDTSz2-zF9AN9ii54AaABAg,That&#39;s a 20.4 billion dollar dataset. Wow and I thought Claritas was expensive.,0
UgyIGOK-biXjGR41GKl4AaABAg,"Thank you.  Wonderful and timely.  Your podcast has provided great content, especially during the necessary social distancing of this year.",1
UgwTB1oyJaxt8UEgtj54AaABAg,Lex have you watched the mini series ‘Devs’ ?,0
UgxF1-JqDhmp8ymPYFF4AaABAg,TY 4 this video Lex! <br>I really appreciated.😊,0
UgzQUZz7MBcXPhNgaZl4AaABAg,"Thanks for the video Lex! I couldn&#39;t be more excited about this breakthrough. The profound implications for the future (years, not decades) of health really hit me in a deep way and make the AI revolution feel like it&#39;s well and truly underway.",0
UgzMzPnagLCA65JumwR4AaABAg,Doesn’t this mean we can cure cancer,0
Ugy-YfWVot8a4HywusV4AaABAg,Please make more of these videos!!!,0
UgzRNWr0y_5Sm5Emv5Z4AaABAg,Why does Google let them release papers detailing their methods instead of just making billions by starting their own healthcare company?,0
UgzdT-6Zu0U_7yc6cTB4AaABAg,"I am a Canadian Masters Student in Computer Science and with a Bachelor Honors in Biochemistry. I actually just wrote a research proposal for a grant that was about the functional prediction from protein structure. So I have recently read up on this literature a bit. Not saying I am an expert though! I think the biggest implications are for protein engineering. Since proteins (Enzymes to be specific) are responsible for the metabolites of all living organisms, being able to design enzymes to produce natural products efficiently is incredible for the production of drugs and almost any other material tbh. Currently, there is literature on how to predict optimal binding sites, but turning that into a functional enzyme is tough. This takes lots of expensive iterations. This is because our prediction models are bad and predicting if proteins are stable to fold. Because models are trained on natural proteins that function the programs aren&#39;t great at telling us what is stable or not, just what a possible fold maybe. but with advancements like these, we will likely get closer to predicting the stability and function of proposed sequences making engineering a possibility. <br><br>Another huge implication is the possible discovery of uncultivatable proteins. A significant amount of biomass on earth cannot be grown in a lab. This leaves an ungodly amount of organisms and their components unstudied. But, the field of metagenomics takes DNA and RNA samples found from soil or other samples and reconstructs potential genomes. From genomes, we can predict possible amino acid sequences and from that, we can predict natural proteins that we would have never seen before!!!  There is always a risk that since the data is from organisms that are cultivatable that the proteins of others may be different in some way, but that is extremely unlikely to be an issue in my opinion. Very Exciting!! On top of this, if we can predict ligand/substrate binding then we can see natural biological compounds that we haven&#39;t seen in the lab before! Natural products have a high efficacy in drug discovery so this is fantastic!<br><br>Big things that still need to be done, in the field are stability prediction, function prediction, ligand/substrate binding prediction, product prediction, dynamic movement prediction for enzymes that go through conformational changes. Lots ahead, but breakthroughs like this make me super hopeful! <br><br>You&#39;re an inspiration Lex! I am hoping to make an impact on substrate/product prediction myself with applications of deep learning!",1
UgxLtX8IUh53GT0eDuJ4AaABAg,Please make more of these videos! this format is easy to digest esp &lt;15min,0
UgzOQOahwLU4VZeKRch4AaABAg,Robot impersonating russian scientist promotes AI as a master race destined to rule Earth,0
UgwrJ-g6-4icLak6uP94AaABAg,"Love this sort of content, Lex, please do more",0
Ugy1i75IQEZNjeVYOut4AaABAg,"Fantastic, but can it fold a paper plane?",0
UgyQuVcTt40jyHCIJJR4AaABAg,Thanks Lex. I feel AI is going to completely revolutionize biology,0
Ugx2xHsUVWRE_bNDoWp4AaABAg,Really impressive work by Lex in just a few days. I get a lot out of this and hope to see more regarding this breakthrough. Particularly I realized that I need to learn more about transformers. I&#39;m not sure what it means but seems similar to the idea that has been on my mind for a while regarding the determination of relevant features...,0
UgwaLDLWqbqUVASyrIh4AaABAg,How many scientific domains can be affected(or mastered) by AlphaFold-like AI? I&#39;m curious and thrilled about that more than about what protein prediction could affect us.,0
UgxWCNrPZxspAAb2LQV4AaABAg,"Extraordinary times! We shall witness wonders in 2021, 2022 and beyond.",0
Ugy817qSEg1qdIjz9Cx4AaABAg,going from ~40s to ~80s in accuracy is astounding (edit ~90+!),0
Ugwx8n09SoKTnHJrkbN4AaABAg,This is so insane later on for the future of digital biology. We will be able to input your genetic code into lets say a future super quantum computer and what will appear will be almost a 90% plus replica of you and even 99%+ later on. remember that one black mirror ep with the digital genetic replicator? This is for real going to happen sometime in our lives. This is amazing.,0
UgzRn3TTBifhynLr4_h4AaABAg,I vote more videos like this. Good job Lex,1
UgxjIKcHC73qW5qCLr14AaABAg,"When I first read the news about the breakthrough, one of my first thoughts was &quot;man, I hope Lex Fridman makes a video breaking some of this down..&quot;<br><br>Thanks Lex, you&#39;re awesome",2
UgzLc8hHjU2wGeYk4Ll4AaABAg,Source code ?? <br>;),0
UgysdtkNqo_vJppkyot4AaABAg,Fun! Exciting videos! Thanks!<br>Always interested in how humans are pushing the limits of science with ML,0
Ugz3lJJd_ygenhPuZHV4AaABAg,"Ultimately, this MIGHT BE a baby step toward high-speed simulations of targeted evolution, wildly like evolving our pets&#39; brains for speech or evolving humanoids for breathing Martian atmosphere, etc.",0
UgwCzcuB_oGQDvWV_9N4AaABAg,Ackchyually,0
UgyU0_R6WGVTC7PxOhZ4AaABAg,"Immortality is here. Not for you, though.",0
UgzaAzFnpHNd3E-tMO14AaABAg,Crazy how their is so much hope in science compared to the news in day to day world.,4
UgzL7tZ_ebeeIJqZC2x4AaABAg,Sorta wishing I can exchange my biochem degree for a computer science degree rn,0
UgzExp7x73Se93bC4YF4AaABAg,plot twist: AI is researching how to make itself replicable,0
Ugzidfu2LanH8TOSo0h4AaABAg,Protein is the building block of life. Makes sense it would work so fast in AI.,0
UgyFiwnCpSPz4Oic-cx4AaABAg,"Baller, keep it up dude! Nice to hear you rap about your own field of study (or nearly so). If you started posting AI 101 lectures I’m sure they’d take off. Cheers!",0
Ugy_ojZ_S_H8reW-Y4R4AaABAg,"AI might just help humans reverse aging, cure diseases and extend lifespans.",16
UgxTo1rBm8MP9s-EKMl4AaABAg,Sign me up for more vids like these!,1
UgyN7fF0oaYt9MrNTWF4AaABAg,"thanks! You should make two (poetic) interviews about it, one with someone from deepmind and one with some structural biologist (like me:)) who is arguably being outsourced by AI, or not.",1
Ugy-Mb_cF49NNXQyBr14AaABAg,Nice work Lex,0
Ugy-81obhbgevM3mlpB4AaABAg,I was waiting soooooo much on them to do it.,0
UgzIdt-Ssr1qUpk9mnR4AaABAg,Very inspiring! Definitely going to spend some time today reading up on protein folding. Thanks for the lesson.,0
Ugy0WEzupnAbSrC4KhF4AaABAg,Love your videos !!!!,0
UgzQn2FxP4Q7bJ5m7vF4AaABAg,Please keep making quick videos like this talking about topics you find fascinating,3
UgwdimwZNblwy4QTOu94AaABAg,"My dad is a molecular biologist and runs a biochem company that specializes in enzyme technologies. His work revolves around creating proteins(enzymes) that are high performant and can massively increase production efficiency for drugs/ingredients and etc. This means a huge amount of laborious lab testing the performance of many proteins they created from the ground up. Computational prediction of protein structures was a frequent topic of our casual discussions, with him often being pessimistic about it, saying that proteins are the most complex structures in the universe, and the combinations are infinitely endless, and that only a quantum computer can begin to qualify such a task. Because I work in I.T, I tend to console him with the notion that A.I algorithms these days are surprisingly powerful, and maybe more suitable for such endeavors. We&#39;ve had this type of dialogue for years. A few days ago when I sent him the news of this breakthrough he was in complete shock. He said this will change the whole game for the entire drugs and biotechnology industry.",0
UgyRj-7kKMJxLSF4z5Z4AaABAg,This is awesome. Thank you (from Canada).,0
UgyCmrh6NhxbiK8Il1p4AaABAg,Thanks for this video!!!,0
UgxRQploSggQY2czvex4AaABAg,"Thank you for highlighting this breakthrough Lex! I would not have realized that something so incredible had been discovered and how much potential a discovery like this holds unless an expert like you had called attention to it, thank you!",0
Ugy-B5QZoO1jcWSoObp4AaABAg,"Holy Mother-of-all-A.I. developments, Batman! This is bigger than velcro. I mean, even for those of us with very limited cognitive skills can see this discovery certainly changes almost everything in life sciences. This was another superb video, Mr. Fridman, bolshoy spasibo ^10.",1
UgxvAowwZ22CByQv_gt4AaABAg,can it predict the structure of protein that has multiple forms like prion?,0
UgyqHd0UICihcKbqIUB4AaABAg,"i wish i could invest in deepmind, i&#39;d bet my net worth on it",0
UgwnQBQmoknHnUjIKYJ4AaABAg,Love it Lex.  Keep going.,0
UgxdTO2-f2qOnKTIR5d4AaABAg,"these short videos are great! I read the alphafold blog earlier, and now watching your video!",2
UgxrcwTn8n_VZ_CZCBB4AaABAg,Lex this is one of the best videos I&#39;ve seen on your channel! As a current BME student this was immensely helpful to my understanding - thank you!,2
Ugxx-W9xCYo4W7TEDJ94AaABAg,&quot;...who&#39;s assigned name just happens to be Lex...I guess we&#39;ll never know...&quot; 🤣 hilarious TY,4
UgyYJdhMfZBLyeiOQCh4AaABAg,Attention mechanisms are taking over. Transformers are in :),1
Ugxo-oMgm4ylwatch8V4AaABAg,I guess one set of input data is a particular sequence. What else? Known crystallographic data?,0
UgzjYPLHAfu5tZXQhNZ4AaABAg,glad you got this up so fast!,1
Ugw3U2Pvh-AjRVF1VZp4AaABAg,"<a href=""https://www.youtube.com/watch?v=Pk4d9lY48GI"">https://www.youtube.com/watch?v=Pk4d9lY48GI</a> - Khan Accademy Amino Acid basics",0
Ugw8uHHEb023UQ-hI-x4AaABAg,Great overview.  Please make more short videos.  They help me immensely,1
Ugxth166oVREiczedR14AaABAg,"Nice, keep doing more of this short videos 👌",1
UgxVPK5S1LTtAWqPVmB4AaABAg,You posted a video on alphafold within hours of me requesting it? Man even my parents dont give me so much attention!,12
UgwyXCedoo-9Ce7N6hR4AaABAg,This was great.,0
UgwQ5MksjfqU_Wkw3wp4AaABAg,Please talk to Manolis Kellis about this!,3
Ugw-osxIv5CokiVesN14AaABAg,"Didn&#39;t understand the explanation of Alphafold 1 very well  (feels like it wasn&#39;t as layman  friendly as it could&#39;ve been) apart from that was informative and interesting. Could have more slides with less content and more visuals as well, would make it a bit less &quot;dry&quot; (I am talking about the slides rather than your spoken explanation to be clear.) But I think a lot of people quite like this old school powerpoint information rich slides style of presentation, so that  seems a  open to debate to be fair. ( Clearly I prefer lots of visuals with more, shorter slides, rather than fewer, longer slides, as it makes it easier to follow, personally)",0
Ugwrf3twujNsGTfBSWd4AaABAg,I LOVE when you produce videos like this!!! Just sayin&#39;,6
UgyGStcJ1-dEPjDWQCN4AaABAg,Is Demis Hassabis coming onto the podcast anytime soon?,34
UgxRKWG7WoSTRaRwhE54AaABAg,Are you familiar with the book by James P. Carse called &quot;Infinite and finite games: a vision of life as possibility and play?&quot;,0
Ugxg8VtXSgpGxIVl0qd4AaABAg,Cool,0
UgwlwX2zvdyT7r5xwTB4AaABAg,"Without a doubt, the most important thing we can program Ai to do, is to teach humans what they learn. Without question! <br>You should have me on your show.",0
UgygoR37r7GNHNwDHX14AaABAg,Keep doing the videos Lex.. you are helping me to learn something new every single day..❤️❤️,2
UgyjSHO0W54Jj1M63tZ4AaABAg,Would love more of these mini-lecture episodes. Great work Lex,114
Ugx2dV0XpZdL7wJFeKd4AaABAg,What??? 🤩😂,0
