CommentID,Comment,LikeCount
Ugzvdx6EFKUyv9NyLuF4AaABAg,"Incredible, thank you Lex!<br><br>(hopefully) Helpful feedback: too much speculation up front on other things, get right into alphafold!",0
Ugzr6hYAPtfmgPsnF314AaABAg,"<a href=""https://www.youtube.com/watch?v=W7wJDJ56c88&amp;t=740"">12:20</a> &quot;Because the protein structure gives us the protein function...&quot; <br>As a student of protein engineering, I have to say this is half true and half not true. It would be true for things like antigens or structural proteins, but not necessarily true for enzymes. You would have to run many simulations on all likely chemical substrates to actually learn something about function that wasn&#39;t already available from the original sequence and the related sequences. One amino acid change can improve/decrease the efficiency of an enzyme by 1000X for a given substrate and catalytic condition (temperature, pH, ect..). But that kind of stuff is already being done on the structures obtained by the previously very slow and expensive process of X-ray crystallography, so now we can use these structures as inputs.",0
UgxWJ9dPFjmrl6ApShZ4AaABAg,"&quot;Levinthal estimated 10^300 possible conformations for a typical protein&quot;<br><a href=""https://deepmind.com/blog/article/alphafold-a-solution-to-a-50-year-old-grand-challenge-in-biology"">https://deepmind.com/blog/article/alphafold-a-solution-to-a-50-year-old-grand-challenge-in-biology</a>",0
UgxakUQ4qwX5lsKHuQV4AaABAg,One step closer to Terminator. Thanks everyone for your hard work.,0
UgwRAS7rddPOrf7FWQB4AaABAg,The next step is going to take the 3D  structure and adding chemical and physical activity in different environmental scenarios!,0
UgxZgFz8y6A3LUewg8l4AaABAg,Alpha fold team interview podcast please!!!!!’,0
UgyksRQdsbfzYWDm_EF4AaABAg,This is one of the most significant advances for mankind!!!,7
Ugx0g495ODnaZ13jTCl4AaABAg,"Advanced medicine &amp; education, bio-engineering/bionics, new energies &amp; materials, smart robots, IoT &amp; big data processing are progressing. <br>They will remove the barrier between artifacts &amp; natural objects, becoming friendly to natural (including body-internal) &amp; social environments. <br>I hope the human species can achieve sustainability on the Earth and expand into space with new techs centered on AI and humane policies. <a href=""https://19084.mitemin.net/i500192/"">https://19084.mitemin.net/i500192/</a>    ／    <a href=""https://19084.mitemin.net/i431264/"">https://19084.mitemin.net/i431264/</a>    ／    <a href=""https://19084.mitemin.net/i456443/"">https://19084.mitemin.net/i456443/</a>",0
UgwdY2_bSiFOKck7F_l4AaABAg,Wtf,0
Ugz8vc1gMTWfrNc-HzJ4AaABAg,Wtd,0
UgzhysKFegpSb0DeSap4AaABAg,I love those short videos that touch on recent advancements in AI - more please. Would love more technical details.,8
Ugx0xojJ4EwCLQxd_e14AaABAg,"Does anyone know how (if) direct donations are possible to support Lex&#39;s fine work? I see the sponsor links, but wonder if direct contributions are possible. Thanks in advance.",2
Ugwexy_j_fSgyGckaTF4AaABAg,Its happening 🤯...we got front row seats guys,1
Ugym9ICWCzO09xyc7FF4AaABAg,"Please make more of these! I bet a lot of your viewers, like me, are undergrads in compsci. Seeing where our degrees could take us and how the skillset we&#39;re learning can be applied in a byte-sized video, that can be watched while on the toilet in the morning is great.",2
UgwkHPiTddSu4Y1gznZ4AaABAg,Thank you for your explanation! 🙏,0
Ugz2sSVuVxATLRqr2zh4AaABAg,in before careful what you wish for <b>sheepish</b>,0
UgwUDv-N7RdG4UmBC1x4AaABAg,Excellent summary insight. Thanks for a guide thru this most complex field.,0
Ugz5ybYb3OMcWpzguQl4AaABAg,Now it makes sense. Thanks Lex.,0
Ugzalxz1D1unqEAenmF4AaABAg,"Hi Lex, new fan here. Quick question. I am a Phd physical chemist whose skills are lacking in programming. It&#39;s obvious that programming is becoming a ubiquitous skill for any science. What language do you recommend people start in, and what organization you may know of that offers classes or tutorials that are good and beats taking a college level intro course?",0
UgzuGnlrzwbSEA17F8J4AaABAg,Will this also help in finding a cure for autoimmune?,0
UgyDGVrkhuBS5ghsYcR4AaABAg,pls make more of these their great,0
Ugz-UunVGknQLz0hJOt4AaABAg,These videos are great,0
Ugx1_iTxAPo4H7bJgA94AaABAg,"The craziest think about AI is that although we can understand its results we can&#39;t understand how they produce that result. They find patterns that are hidden from us even though, they are there, in the hard drive of a computer.",0
UgwWDUhW9YhkGXGXU914AaABAg,"Lex, could you put some more time in on this one? I don&#39;t recall your video on the first AlphaFold, but you lean heavily on prior knowledge of it in your speculation on AlphaFold 2. I think this one deserves a closer look. Maybe try to rope someone in on this who has been involved in humanity&#39;s previous computational approaches to protein folding (folding @home probably has a number of alumni.) Thanks for all your great content!",0
Ugx2Bism1IIh0PJSdnN4AaABAg,"you know what&#39;s the craziest prediction to come true in recent history? Donald Trump predicting that the future&#39;s biggest health breakthroughs would happen on his watch. I believe this was said originally in his acceptance speech, and later again on multiple occasions. <br><br>almost like they know what&#39;s coming ahead of time ;)",0
UgwV3weHGWYB539yitp4AaABAg,"First rule of public relations. Always talk about what you have achieved.<br>But there&#39;s a ton of problems AI can&#39;t solve, and will never solve.<br>Everybody should know what kind of problems can be done with AI, to evaluate the potential of this technology.<br>This (AI-Metaknowledge) should be basic education in schools. Otherwise you have to believe everything what others tell.",0
UgxPVpmWgq7CYEklkPV4AaABAg,Brave Protein Flow,0
UgzR3_I57H2sPoiRT-B4AaABAg,nobel prize in biology?,0
UgwdTSp_lwzLUgS1FNJ4AaABAg,When you just finished getting used to CNNs and &quot;transformers&quot; come in to say hello,1
UgxRye-dyG3eZJHIyqZ4AaABAg,Please someone make an enzyme to catalyze water to hydrogen gas,0
UgyQtOFq4cmDhC79_3B4AaABAg,I want to be one of those robot dogs 50 years down the line!,0
UgymkM-9UcI5VgNmE294AaABAg,"Chess has 10^120 games and go has 10^360 games. No limit Texas Holdem on the other hand has an infinite number of games (hand combos, bet sizes, number of players, etc).",0
Ugy73knReW9-4lz4_yF4AaABAg,I think one of the other implications of this scientific leap is that no single individual can claim it&#39;s full achievement the same way let&#39;s say Watson and crick did when they discovered the DNA helix. We&#39;re past that time I think.,0
UgxG2R8iYpEnAE0DcLJ4AaABAg,"Great video, please keep the AI tutorials coming!",0
UgwLLHAWR7zyF8VwOsZ4AaABAg,"This is a great video with a useful insight into how DeepMind came to win CASP. As a biochemist and bioinformatician who has been part of the effort to &quot;solve the protein folding&quot; problem I would say that strictly speaking the problem has not actually been solved. I say this because the research many people focused on was &quot;how do proteins fold into specific configurations?&quot; The DeepMind solution does NOT answer that question. There is no insight into the biophysical rules that guide the folding. And the reason that research has centred specifically on understanding &quot;how&quot; is because the answer to THAT question gives answers in BOTH directions of the problem. DeepMind can go from sequence to structure, but it cannot go from structure to sequence (&quot;I want a protein that has this structure - what sequence gives me that?&quot;).<br><br>Of course, with further AI and computing power, it is possible to start from a structure that has a similar form to what you wish to create and therefore it is just a matter of applying a genetic algorithm  which does what it was created to mimic, to go through the combinations until the target structure is reached. But still, it isn&#39;t &quot;understanding&quot;, it is just doing.<br><br>The other thing I would say that DeepMind does not do is offer insight into diseases caused by misfolded proteins. And to be specific here, a misfolded protein is a protein that has not folded into the configuration that its sequence predicts to fold into, usually because of unusual factors within the folding environment. DeepMind can only go from sequence to structure. It cannot provide any information about the folding process or influences of the folding environment. For diseases where &quot;misfolding&quot; is due to sequence mutations strictly speaking the protein is folding correctly, just not the same as the native sequence. For these mutated sequences, yes, DeepMind will help.<br><br>I have said for a long time that the problem of protein structure prediction would be broken by the brute force of AI. But the protein folding problem still exists.",0
UgySgTpIl6DdZ8nDMxF4AaABAg,"An underlying notion in microbiology is that structure begets function. There is an charge and distance character to each of the amino acids that create &quot;activity sites&quot; for physical or chemical reactions to occur. Thus the order of amino acids is the structure, and that determines the function. When I say order of amino acids, we can think about that in two ways. First, is the linear order of the amino acids as they come off the assembly line so-to-speak. Second, and far more important, is how this linear order conforms in the 3d space- hence folding. One key characteristic of amino acids is their tendency to orient with or against water, hydrophilic (with) or hydrophobic (against). The space where proteins is fold is all water, generally, and therefore the hydrophobic amino acids must congregate to reduce their free energy. This is generally what protein folding in the 3-d space comes down to. All of this is to say that if we can understand how a protein will fold, we can better determine it&#39;s function.<br><br>What makes this breakthrough so incredible is that once we have quick method for generating structures, we can fill in the functional landscape. This allows use to scan the breadth of protein function for attributes we deem useful, and apply them how we see fit. Now comes in the necessity of big data management and machine learning techniques- which I know far less about. It&#39;s an exciting, and utterly confusing, world we have going.",0
Ugx43l85BirFnl8iKmN4AaABAg,It is [a physics-based simulation of a biological system] whose assigned name happens to be Lex.,1
UgzRkNCRUJp1I1KpiQJ4AaABAg,Could you say more about what these attentional methods involve?,0
UgwYsSKo39MVx1cJrrd4AaABAg,"Protein-Complex formation is quite an interesting thing, however it is also a lot more complex than what AlphaFold is currently doing. Rearrangements in proteins are a minute sequence of movements which are hard to model. On top of that, there are several possible structures of proteins that are equally true. Just for an example, the spike protein of viruses (take SARS-CoV-2 as an example) undergoes a vast rearrangement from its pre-fusion form to its fused form where the innere helices extend into the cell membrane of the host. But what you cannot model and what AlphaFold and AI cannot predict - so far - are the intermediate steps. For me working in the field of bioinformatics and simulation of proteins the AI approach solves a lot of questions but also leaves some, at least for me, more important questions unanswered. AlphaFold cannot give an answer to the underlying mechanisms of protein folding but gives a solution to the folding problem. However, there are complementary methods like molecular dynamics simulations that can answer some of these questions. In the end, I am really stoked about AlphaFold 2.0!",0
UgzuejLNxUCbNqwWDId4AaABAg,The total number of moves in chess is estimated to be 10^120. The number is called Shannon&#39;s number.,1
UgzxxEp6nKck-GzklDZ4AaABAg,What about the financial aspect? Isn&#39;t the whole AI team employed by Google? I assume they&#39;re going to make money off of this somehow. Are they going to charge per predicted protein folding? Can they provide services to the Chinese or is that off-limits? They can certainly make billions of dollars from this with all these applications.,0
UgwDiM0NIxltnn2HLAx4AaABAg,"Some Diseases are just because of misfolds of the protein or caused by a misfold. This is just mindblowing to me. But then in Origami, you can create a 3D structure by folding a 2D paper a certain way. There might be some origami models which can be folded via different steps to the same 3D model, but generally if you fold it incorrectly the outcome will not look right...",0
UgyjBX6gnQakzigQNiB4AaABAg,"I am a fan of your work Lex Fridman... I am a researcher in the field of ML/DL, and in future I would like to work with you in some research project...",0
UgzFvCfKVNjxyeyY68V4AaABAg,The Deepmind guy is definitely getting invited back to Builderberg for this one. Holy  shit.,0
UgzQEfCsGnwR-KH-u094AaABAg,"Not to supress the hype, but if there is only 170,000 available protein structures to train from out of 200 million, this is likely not enough to generalise well throughout the entire dataset.",0
UgxCiTw0nSOPx_W-Ye54AaABAg,"Looks like the neural network has passes a critical level of sophistication, with big implications in all computational fields, and this class of mathematical problems.",0
UgzVaBkEQb8DWyLV04Z4AaABAg,Podcast with Brian Greene ??,0
UgyX5KlT9XAhnIlLKRh4AaABAg,"All of this based on the work of Alfonso Valencia, still alive bioinformatic",0
UgwbVhhJj5hIqbT4VbB4AaABAg,I&#39;m thinking that one day the human have to Nobel awarded to AI. No joke,0
Ugyhez6Wi6hozDJIrfl4AaABAg,Many Beers? Clickbait detected ;-). But as a guy who burned out an old laptop to folding@home it’s cool to hear big advancements.,0
UgyeOtEN8yNwTukN7xB4AaABAg,"You had to bring simulation possible reality into this! xDD Oh, i love you man :)",0
UgzGbu9gvT4gebbK1mZ4AaABAg,&quot;CNN out TRANSFORMERS  in&quot;🔥🔥🔥,0
UgzyL0CPrHbwgE74YQp4AaABAg,Have a podcast with the creator of Golem Network,0
Ugx6WwKMMaEPnqm7q7Z4AaABAg,Make more 😀,0
UgzkGVKrVM-aIQAF9fd4AaABAg,&quot;How do we know this is not a physics-based simulation of a biological system whose assigned name happens to be Lex. I guess we&#39;ll neve know&quot;. Looks like Lex is spending way too much time with George Hotz and Joe Rogan.,0
Ugx-epylmzEgYjb1Seh4AaABAg,Great Video!!,0
UgzB5MSKidR6DNkqHCd4AaABAg,I love this format.,0
Ugx766QIqYEzrhowxwd4AaABAg,Really appreciate you sharing what you learn.  Thank you very much!,0
UgwAni3GS9Or0poLl_F4AaABAg,Anti-aging is always interesting ... assuming the world can afford people who are capable living to 200 or beyond.,0
Ugy66eqdwneP2BIRh3l4AaABAg,The mitochondria is the powerhouse of the cell.<br><br>That’s all my neural net remembers about biology...,0
UgwYLpAmwpi721z2Nzp4AaABAg,What is protein folding ?,0
UgyhssjhaMvhRy7-vLt4AaABAg,"mannnn this takes me back to my biochem classes, what a time to be alive",0
Ugz8yv4817KOnFA1JxZ4AaABAg,How did you get to 21 amino acids?,0
UgzXY_uzqQ7bbYacHsR4AaABAg,"As someone who spent a couple semesters working on protein folding ML problems and familiarizing myself with the literature, I respectfully disagree with all of your assertions about it being the &quot;biggest advancement&quot; in either structural biology or artificial intelligence. All CASP participants know this performance was inevitable, and we would achieve it merely as a result of improved silicon and the combining of techniques featured in the previous year&#39;s conference. As a biochemist, I am apprehensive about the empirical rigor we see with deep learning research in general. DeepMind has always been full of hype while hush hush on details in a way that makes it difficult for actual scientists to appreciate. 87% is impressive, but frankly, this does nothing to quell my skepticism (or the rest of research community&#39;s, for that matter). Additionally, AlphaFold is clearly intended to become a commercial product, which is why DeepMind doesn&#39;t give a rat&#39;s ass about establishing their rigor within the literature. It only requires a vague semblance of academic authority to sell to Big Pharma.<br>This was a fun and well-explained video, but Lex, as a fellow deep learning researcher, your unmitigated optimism w.r.t. DeepMind comes across as that of a kool aid drinker. You are fanboying hard for a quasi-academic Google product in a way that makes self-respecting scientists cringe.",0
UgwO6u3BWzxpNHLsnlt4AaABAg,After the publication is released you should have one of the developers on the show :),0
Ugy6qTudhxAuUhGiUBV4AaABAg,"Oooh I wonder if this will have any implications/applications to Astrobiology, and how life came to be.<br>Couldn&#39;t come at a better time with the Astroid Sample Return missions coming home this year!",0
UgzZc0M09Pmk1A0qAjN4AaABAg,"wait so there 10^143 possibilities to fold a protein, and if it gets it wrong once we get a disease?<br><b>insert existential crisis</b>",0
UgzO8RrFowKj4OZ59d54AaABAg,Please stay on youtube. Dont pull a &quot;Rogan&quot; on us.  Please!!!! <br>Love your podcast.<br>Quick question. <br>Why is pirate &quot;booty&quot;  protected by &quot;boobie&quot; traps.<br>Should they not be called &quot;booty traps&quot;  ?,0
Ugzp3xfO_62Xlclsv_54AaABAg,"Thanks for the dose of knowledge and philosophy, Lex. You&#39;re a legend",0
UgzKVDDg8IcIXvN-Nup4AaABAg,"Lex love your stuff, still think you&#39;re an alien hybrid though but a little Vick Sinex nasal spray with perfect your human transformation, keep on keeping on buddy boy.",1
Ugx7ljTHe4TBA2QwLuZ4AaABAg,Lex do more of these videos my man! Great work!,0
UgwJQQOIVnZzl6mJMHt4AaABAg,As a long time (since december 2000; 2 decades this month!) Folding@home participant... I&#39;m soooo curious what the impact of AlphaFold (2) will be on a project like this!,0
Ugz3GnJwRouH8di4e1Z4AaABAg,Big fan of these-  thanks for contextualizing important scientific updates with your romantic ways,0
UgzHVzjQUP--2uns5Bt4AaABAg,"Wow that&#39;s exactly the AlphaFold coverage I needed!!<br>Thank you so much Lex, you are a beast!",0
Ugy1H1qYig93wubsrO94AaABAg,chess ~10^120 possible games (see Shannon number in Wikipedia),0
UgxdpDHwuN3rT9x-4RN4AaABAg,"Thanks Lex. Groundbreaking development explained in groundbreaking video. You&#39;re honest, passionate and we trust you.  Thanks a lot.",0
UgxzM2hBRcDNqRl1J194AaABAg,and make more of these please!,0
Ugwgx87rBG5wfE8meDx4AaABAg,"Awesome video, I knew it was a great discovery, thanks for helping us understand. Also, don&#39;t be so hard on yourself, being poetic is good:)",0
UgxJjC_ggc5EF59wSGR4AaABAg,"I hope there are going to make a decompiler for a human brain, cause the current machine learning models are extremely inefficient.",0
UgygkKz_w4ZxNOoyncB4AaABAg,This is more like 3D chess.  Thanks for the briefing on probably the most complex topic.,0
UgxMRnPE8kj_IUSABWd4AaABAg,"I wonder if they really considered the DNA sequence of the gene coding for the proteins they tried to predict. As a protein doesn&#39;t just come into existence instantaneously, they are produced one aminoacid at a time and with different interval speeds depending on the coding usage of the host organism, the gene sequence and many more factors. This all giving room to different thermodynamic scenarios for the folding of each generated part of the protein... And then come into play chaperones, guiding the folding independently...<br><br>I am really looking forward to finding out how they handled everything that&#39;s not just pure thermodynamics of proteinfolding.",0
UgxX06_qYgBewpyXsPt4AaABAg,also... thanks for this presentation ... good stuff!,0
UgxY0ofAsg4sU7QPuKx4AaABAg,Interesting. The idea of having multiple steps to break down the problem is certainly one insight I took out of this. Long live the simulation known as Lex :),0
Ugz5N33GXrX7qReWLLJ4AaABAg,can you get Jonathan Gorard on your podcast .. you may not know him ..but he is an interesting mathematician .. .thanks !,0
Ugx5DCNFo_xMVJbs1794AaABAg,can you and Joe Rogan get together and discuss this ... i think folks would find this interesting ..,0
UgwDgl11FpEs64u6i6F4AaABAg,"Thanks, Lex, for making a little bit more sense about it for us mere mortals.",0
Ugx_D-OpBqx7WiV2mDV4AaABAg,Great work. Thank you for doing this Episode.,0
UgzSMXaN_q_7V_cJ2dB4AaABAg,<b>Please ask your dad this question</b>   links in reply. !!!,0
Ugwf9zhXuNmxM1KRil94AaABAg,When are we gonna see Demis Hassabis on your podcast? Would love to listen to the discussion.,0
UgxxqooJZNVvbsCE47l4AaABAg,They are &#39;somewhat&#39; useful to me.,0
Ugwf2HEsCLOX6jRI4F54AaABAg,i wonder when they will add a Nobel Prize for AIs.,0
UgwkK029fjT3GhmkSWB4AaABAg,will this cure mortality?,0
UgwQw5ZHgVlqsEsQuBJ4AaABAg,Great video Lex! Keep them coming.,0
UgzgFJlsqFGmOrKxZPt4AaABAg,"I went to bed reading Superintelligence by Nick Bostrom, ending right at the part where and super intelligent AI solves the protein folding problem and then uses synthetic biology printing to take over the world. Then I see this video not 5 minutes after I put the book down. Eerie",0
Ugy1t1q7YJ3uzutU4VN4AaABAg,Thx for all the knowledge your spreading! Great video,0
Ugw8W6gz9b9jk3ejlrB4AaABAg,"Thanks Lex!  Linked to your video in my daily newsletter on illiberalism and liberalism:  <a href=""https://snsmkr.com/the-fruits-and-thorns-of-liberalism-and-illiberalism-snsmkr-daily-digest/"">https://snsmkr.com/the-fruits-and-thorns-of-liberalism-and-illiberalism-snsmkr-daily-digest/</a>",0
UgzSZ-nRyUlebZypaGl4AaABAg,"Just a heads-up to those commenting..... it appears there is a &quot;Lex Fridman impersonator&quot; leaving replies to comments you post here, and offering crypto currency trading schemes.",0
Ugy-9Qv__ZJaNJZY3PF4AaABAg,Glad to follow this revolution,0
UgxySUVbn54yKjME28Z4AaABAg,Hugh Ross would be a great guest for you.,0
UgyaOelegTuwIhe5PMB4AaABAg,thanks for making me less stupid :) youre the best!,0
UgyPNimqlBXiM3J3EUN4AaABAg,💞💞💞💘,0
UgzuLmOf9EwtpK9nw-l4AaABAg,There are no infinite games of chess,0
Ugysgf7n4fh0aPsuUsV4AaABAg,i like these videos! have you looked into eyewire or Sebastian Seung&#39;s work on using AI to reconstruct neurons,0
Ugw1yvVwoTVpyplUqAN4AaABAg,I love these video&#39;s,0
UgysWJnze2aOPRfYcUh4AaABAg,I believe it is a spatial graph approach because it is not spectral.,0
UgyhSwchwA9m2xprZmN4AaABAg,"More short videos brother✊🏽, keep putting out the long format, but these short videos are great when I’m making coffee in the morning",0
UgyKqTJkEY0zFxkdi3d4AaABAg,farmology,0
UgzMw9XITJOQdWHgXw14AaABAg,Quick call with Manolis Kellis needed t odetermine and explain importance and consequences,0
Ugz2OC_3cui2kbcXm1x4AaABAg,"Great Job! I particularly liked when you nerded-out at the end with the mind blowing awe-ness of encoded systems of proteins. Just like mathematics, computer language, and esoteric studies, Biology contains encoded information in plain sight. That 4 simple molecules in our DNA control all the diversity in Life as we see it and may be seemingly linked through gradual evolution, or even the daily process in an organism from their DNA through to every protien-fxn they need in a day/life/life cycle is computationally mind-blowing and YES ALPHA-FOLD WILL OPEN THE DOOR TO A NEW FUTURE. Whew, See i just nerded-out too.",0
Ugz1BZrlCaPxyR038cp4AaABAg,"no, alpha fold did not &quot;solve&quot; protein folding. For starters, the protein folding problem is not &quot;Can I take a sequence to a 3D fold?&quot; The problem is &quot;Why/how does sequence result in that fold?&quot;<br><br>Secondly, if we look at the structure prediction problem (which is the problem they actually made progress on), they are nowhere close, they&#39;re just outperforming their academic counterparts. For instance, notice how they do not predict the structure of, say, a membrane protein, and also stick to a narrow range of globular enzymes. Proteins are wildly diverse and CASP has always been criticized for not being generalizeable.<br><br>Finally, structure prediction is not the premier problem of the field, the premier problem is refinement, which is the process needed to perfect the structures to the point where they are (debatably, I would say, as a harsh critic of theoretical molecular biophysics) usable in various scientific and engineering applications. Deep &quot;learning&quot; performs just as well here as it does many other disciplines of applied physics, which is to say abysmally.<br><br>Stop spreading fake news about fake science. Call deep &quot;learning&quot; what it is: network function regression. It&#39;s just a boring regression technique, and an unwieldy one at that. Sad!",0
UgzPkFjyGFdcanszoPh4AaABAg,"There&#39;s no such thing as an infinite game of chess, because it&#39;s a draw if no pieces or pawns are taken for (I think) 50 moves.",0
UgzY09G06ZGtadbLM4Z4AaABAg,"Thanks Lex, I really enjoy this style of video. Please keep them coming!",3
UgydUeWkT_asvSlQe614AaABAg,"Thanks for the breakdown, Lex. I&#39;ve been excited to read about what is coming out of the AlphaFold news but your breakdown, as usual, is the most entertaining and informative.",0
UgyQ5N0i2aJe1UUrDk54AaABAg,The Thought Emporium&#39;s vid on it is gonna be great.<br>(He does applied biology with crispr amongst other things like holograms),1
UgwqOe0RPHO5hDJCjUR4AaABAg,so with this you think anti ageing is near term not long term? is near term in like 10 Years or more like 25 years?,0
UgwZzhjM8Lo6g-jOGr54AaABAg,Loved it,0
Ugy9y5ODRFmrSgjWgAx4AaABAg,FROM INSTAGRAM POST TO YOUTUBE POST....,0
UgzHnPgcPOs6Iy5q4VN4AaABAg,&quot; Life is weirder than Chess &quot;<br>- Frustrated Alpha0<br><br>Btw 10^120 chess games are possible,0
