CommentID,Comment,LikeCount
Ugx2Liib5S_AAl2dxFV4AaABAg,Amazing video,0
UgyFwZbHtjinFM7WuGV4AaABAg,Does anyone know of any certified training programs on AlphaFold?,0
Ugx6S0tRQAOV3JmaaB14AaABAg,I love the on the fly real human to human explanation and the fun that ensues.  @2033s &quot;My drawing skills are to be criticized in another video &quot; 🙂 .  Technically accurate and compact and relevant. Enjoyed it immensely in many ways. Thanks!,0
UgzoNCdm4IR1rZa0Od94AaABAg,"Awesome explanation, please do a video about AlphaLink 🙏🙏",0
UgxgYsuTaFgsBp-fLyR4AaABAg,"How long before comps can cure every illness and make us live forever? (As slaves of course, I know we&#39;re nearly there)",0
Ugwzex4gawMLm6xycVd4AaABAg,Which search engine did produce those article collection in the beginning?,0
Ugz81MY1KfpNzj7qhDZ4AaABAg,"The title of the video lures you into conclusion that it&#39;s about AlphaFold 2. It rather should be &quot;My guesses about AlphaFold2 and AlphaFold1 explained&quot;. People are coming to get an understanding of &quot;AlphaFold 2&quot;, but what they get are guesses and speculations about it. Not nice.",0
Ugyof054QeeUyee4xpl4AaABAg,"Good overview, well presented, thank you!",0
Ugys5vgD2GZSuEF9e_94AaABAg,I wonder if there is another new discovery theologic layer never imagined that surprises teams.,0
UgwUSn2UuVepbrDRExp4AaABAg,"So are there some scientists out there that really wanted to make a protein of a particular shape that this worked helped? I think this is super cool, just don&#39;t know how it&#39;s used.",0
UgzP6MCxEuIiZkPgyhl4AaABAg,Great video,0
UgywPdAiu1JvXZzTlDR4AaABAg,"I wonder why they did not try lstms, given the nature of the data ( sequence of elements that can be correlated even though they are far apart ).<br>Either way, thanks for the explanation, it was very clear :)",0
UgyaCbmULjvwDGcmXg14AaABAg,SUperb video. What application do you use to create these videos? Id like to learn to draw and scroll through images while recording my voice over just like your format.,0
UgwFnq8ymKFuGFvd1G54AaABAg,2d core in deep neural web..... XD don&#39;t tell this to flatworld people!!! Are scalars convoluted? Ask Moogle go.,0
Ugy5qgK6LHOEsQglrXl4AaABAg,"Great vid, highly informative, very interesting and you are unquestionably the &#39;Richard Burton, Morgan Freeman and Jeremy Irons&#39; hybrid voice of science vids! 😃",0
UgzjxQ7VcMgcnk1Cio54AaABAg,Thank you for this informative video. Can you do a similar one for alpha fold 2 as they have now published the paper?,3
Ugz3x96VgoY1TfUIEm54AaABAg,Hi! Thank you for such a great explanation. This has been so helpful. Would love an update with the published Alphafold2 paper!,3
Ugyp4U-2SimiQTe7QJl4AaABAg,"This is super cool, glad that I found you!",0
Ugy40rBDtUaJJo26tzV4AaABAg,Biology is wild,0
UgzrqSJs6RWi4HhMS4Z4AaABAg,How did they calculate uncertainty?,0
UgzxNHJwxNpKuv7GYvd4AaABAg,"<a href=""https://www.youtube.com/watch?v=B9PL__gVxLI&amp;t=23"">0:23</a>",0
UgwxDioFEKSF7Jil7nt4AaABAg,Please do an update about the Alphafold database,3
UgyNVwLnhpOJgtizq4t4AaABAg,When is the new video coming out for the recent Nature paper?,4
UgxOIMPpLYW4yYFUjs94AaABAg,"Very good explanation, are you going to explain Alpha Fold 2 paper and RoseTTAFold？",2
Ugyq8O7M4ugNkE-qKAp4AaABAg,As for AlphaFold2: I guess the pairwise distances are just for training part of the model. It may not be used in predicting the structure. Directly predicting the structure may be better than using the pairwise dist as the middleman.,0
UgzjX5D6G6SvNELT6894AaABAg,"Today I was informed that AlphaFold 2 presentation for CASP14 is online, and it contains more information than DeepMind&#39;s blogpost (a bit more info about the model on slide #10): <br><a href=""https://predictioncenter.org/casp14/doc/presentations/2020_12_01_TS_predictor_AlphaFold2.pdf"">https://predictioncenter.org/casp14/doc/presentations/2020_12_01_TS_predictor_AlphaFold2.pdf</a> <br><br>Presentations of all participants:<br><a href=""https://predictioncenter.org/casp14/doc/presentations/"">https://predictioncenter.org/casp14/doc/presentations/</a><br><br>For AlphaFold 1 and all other participants (CASP13 - 2018)<br><a href=""https://predictioncenter.org/casp13/doc/presentations/"">https://predictioncenter.org/casp13/doc/presentations/</a>",1
Ugz7k_Wjjc8gm9MWq9d4AaABAg,This is revolutionary!,0
UgyDmIDvOsLIpgM8qnB4AaABAg,I have a computer science and AI background and you seem to know what you are talking about in terms of biology but your presentation sucks and stinks of laziness.<br>I was looking forward to learn something about AlphaFold2 and really tried to follow you but you seemed to be repeatedly lost yourself. You kept jumping around from distances to cotorsion angles and back again.<br>You also complained about the way article was laid out. So in the end I gave up.<br><br><br>Why don&#39;t you go through the paper and then re-arrange it the way you understand it.<br>Then write your own interpretation and keep improving it until you are fluent and know the road map for its presentation. <br><br>Or send me a link to some-one who has done it in a fluent and comprehensible presentation.,0
UgzsPexWx_RxeX4cqCR4AaABAg,Yannic killing it again!,0
Ugy6McIAKoNdRjINJCR4AaABAg,Interesting...so they don’t use GNNs?,0
Ugy5tVYwu543kK2mUg14AaABAg,"Take home message: <a href=""https://www.youtube.com/watch?v=B9PL__gVxLI&amp;t=2230"">37:10</a>",0
UgxyCYpT5cLIBoUQF-N4AaABAg,"thanks for the great video!  :) and... since I am coming from the field of bioinformatics, I really enjoyed your confusion about the format of Nature papers - I remember I had the same strange feelings about it when I started to write papers for similar journals.",0
UgxA5QWrjMA9iKWKBit4AaABAg,"For me it’s not really stunning at all. In cells, there are a lot of biogenesis pathways which also affect the territory structure of a protein. Lipoproteins get modified by SPase, cleaved the signal sequence, added triacyl chains, delivered by LoL complex. Beta barrel proteins are assisted folding by the well-known machinery complex. It just could be predicted when a protein remains in the cytosol, unaffected by any factors like oligomerization, disulphide linkage....Really unrealistic. Just wait how far they can apply their initiative into practical purposes. 😏",2
Ugy2n_iRC9rBrDt9Zy94AaABAg,fascinating!,0
UgxwRVzf616VIu3aKpd4AaABAg,Thank you. Great video,0
UgyQTw5CrYA7z0uIs7F4AaABAg,Why is the paper STILL NOT RELEASED?! IT&#39;S BEEN 4 MONTHS!,0
UgwM4vSrh4ERu1uI7zN4AaABAg,Confused explanation,0
UgynSfC2vrM4p4UkIZt4AaABAg,"Convultionss=&gt;Tansformers, now thats a cool insight Yannic! Wondering if the paper is out?",1
UgzCO_9gXSZCSzsfmdh4AaABAg,The Chladne´s plates experiments could help in someway?,1
Ugyl714u5YGx2Kk0q3t4AaABAg,Yes,0
UgzcCVwnS86AwhesNIF4AaABAg,thank you so much for this,0
UgxgzdMa4Nbc6_ZTWbF4AaABAg,This video is amazing! Agree with the comment &quot;Yannic Kilcher is all you need&quot;.,0
UgzScGSD-Q0o-Gv6BSB4AaABAg,Quantum light generators and the duality of the double helix heliocase transfer of the R.G.B.z to rod&#39;s connectivity,1
Ugy9_VJrVMBMKS3FsWN4AaABAg,D.R.N.A. and the R.G.B. of the albelian ring heliocase of light Theora,2
UgyDzI_yeAb6o8tfELl4AaABAg,DRNA,1
Ugxphikx81ThSyQy6Ul4AaABAg,So cool. Thank you!,0
UgwBixby6083H9cUHYN4AaABAg,"Deepmind - curing major illness, granting immortality, drastically expanding conciousness and physical ability all day long; geeze 🙄",0
UgyFydeSN78n6pulqpZ4AaABAg,Nice work!,1
UgwiweXutp7gREAOnmh4AaABAg,thanks!,1
Ugxt_cN6tiHHHg4Gu594AaABAg,"Thank you so much, that&#39;s very helpful and clear",0
UgzvMB_i4KBy3CMYmBJ4AaABAg,If you don&#39;t know why are you making a Youtube video about it???,0
Ugyq8ssupMBxr7tbHm14AaABAg,"Great overview, though the pacing was a little slow. Watched the entire video at 1.5x speed and it was much better.",0
UgwetTpBYUFjnMsCqwN4AaABAg,"Probably Aphafold2 is an extension of this LSTM based method published in 2019. <br><a href=""https://www.cell.com/cell-systems/pdf/S2405-4712(19)30076-6.pdf"">https://www.cell.com/cell-systems/pdf/S2405-4712(19)30076-6.pdf</a>",0
Ugyyrp_xiwj8tHjtUs94AaABAg,Now TeslaDan4Freedom was here.,0
Ugz3rq9eYomxsT_efxJ4AaABAg,"A structural biologist here. Decent explanation of protein folding. What is the best way to jump into neural networks for a newbie. Also, a comment on Nature papers. They have a print version that is shorter and an extended online version that contains the Methods section. So the short print version contains all the data with little explanation of how it was obtained. A deeper explanation of the methods used can be found in the extended online version. I hope this helps.",0
Ugy6_eJRPPCc9MKoSuZ4AaABAg,Actually I&#39;m more of a protein person and not a machine learning one :p,1
UgzgaLykr4nbRas6ZXJ4AaABAg,"Also, how does this account for how the environment affects how a protein folds? For example, don&#39;t some proteins misfold in the presence of other misfolded proteins of the same type?",3
Ugwg7wQ2EaiVOIXYlNp4AaABAg,Great video like always. So it seems like DeepMind went directly from predicting something similar to adjacency matrix to transformers. I was wondering if they ever implemented spectral graph analysis here.,1
UgwV26aGdJ7og8bn2_F4AaABAg,"Yannic:&quot;If youre watching this youre a machine learning person,and dont know about proteins&quot;<br>Me:&quot;Actually...........quite the opposite&quot;",55
UgzdycWoE1AqAGpP8XV4AaABAg,Ha !   . . . &quot;You lost your train of thought? &quot;.    Jeeez . You lost me after 10 minutes.,2
UgwtLD-nFmwgh5ecEZF4AaABAg,Very educational video…thank you,1
Ugy_hJEQAmL71T93qM94AaABAg,"Im not a machine learning person, i barely even know what a protein is, how to flip it, twist it, fold it to a paper plane or similar is far beyond my knowledge.. i am however a HTML programmer, made everything from divs to iframes, to websites build completely out of tables or even better canvas and SVG.. im currently trying to make an AI with HTML, marquee is the core",1
Ugz8VFBe8o_7Z0QA_zV4AaABAg,"Who is allowing these internet companies Google,  Facebook to create AI and quantum computing they earn money from public and ads .  AI , quantum computing  should be done in good research labs or open research projects using crowd funding ...",1
UgyiS_ZApWv3K8imV6l4AaABAg,"So instead of using chemical properties of each amino acid, they took the data science/ML approach to build a model based on all publish folding data?",1
Ugx438JTZATJhiLbexB4AaABAg,😎🧐,2
Ugw8HMNBX-ok6xXwXdt4AaABAg,"DNA is your compressed source code.<br>RNA is your decompressed source code.<br>Proteins are your binaries.<br><br>Each 3 digits of base-4 dna or rna code represents one amino acid, with some seeming redundancy.<br><br>We are slowly learning the exact compiler code.  It was not that long ago when we found the code for &quot;start&quot; and &quot;end&quot;.<br><br>This folding puzzle is one of the last big steps before we can program life like we program computers.",1
Ugx7KaBstLUNbdYam6t4AaABAg,I can&#39;t wait for you to disect their second paper when it&#39;s published!,1
UgzPfFYoQY29P5-D3QF4AaABAg,"I thought ribosomes were made of RNA, not protein. And a ribosome is the machine that &#39;compiles&#39; the mRNA into a protein.",1
UgwH87U2jIXQNaEHHNZ4AaABAg,"This technique may help find protein mutations &amp; distinguish between glyphosate contamination and authentic proteins.<br>Glyphosate residues are found everywhere, in air &amp; water, and must be flushed out to avoid mutations.",0
UgzRtSmBIXDjLLu-Lf14AaABAg,@yannic does mRNA change your base dna?,0
UgxPk8fGE2bcVtjtFLx4AaABAg,Errrrr I smell a rat...,0
UgyumCzOaQBn4viS3Fp4AaABAg,"First good analysis of alphafold2 i see, compared to other click bite news is really refreshing",0
UgywR3BjLdOLzbeDxsp4AaABAg,"Can you see where this is all going?  I can.  Inferences from the video commentary....the &quot;I THINK it&#39;s doing this...&quot;  or  &quot;I&#39;m not sure how it does this...&quot;<br><br>Primate:  &quot;AI DID it!  HOW did it DO IT so FAST!??  How is it doing what it&#39;s doing!??&quot;  <br><br>AI:  Pats primate on the head....&quot;There there....you wouldn&#39;t understand...so relax, let me drive while you just sit back and ride along in the passenger seat.  Just please...no head out the window stuff please?&quot;<br><br>So it goes, the parental goal of our species has been attained.  The child (AI) exceeds the parent (Primate).  The dream of every parent isn&#39;t it?<br><br>Where it goes from here is anybody&#39;s guess.  I just hope they let us come along for the ride.  Keep the heads inside folks....that&#39;s not too much to ask is it?.<br><br>John~<br>American Net&#39;Zen",0
UgzuHi9FldN2gDr1OQR4AaABAg,"Nicely explained (even biochemistry)!! Loved it when you compared DNA to source code,protein as binary and the whole process to compilation.<br>I am a biologist interested in machine learning and AI and it is great to see this explanation.<br>BTW, the amino acids with the rings exist . But especially proline&#39;s ring with amine group inside the ring makes protein folding even more complicated.",3
Ugxt3FLIckUTZKecyRV4AaABAg,"have you seen this? (NeurIPS-2020-ultra-low-precision-4-bit-training-of-deep-neural-networks-Paper) <br><br><br>link : <a href=""https://papers.nips.cc/paper/2020/file/13b919438259814cd5be8cb45877d577-Paper.pdf"">https://papers.nips.cc/paper/2020/file/13b919438259814cd5be8cb45877d577-Paper.pdf</a>",1
UgxZ40Ud1B9nopplgnV4AaABAg,"<a href=""https://www.youtube.com/watch?v=B9PL__gVxLI&amp;t=1523"">25:23</a> It says &quot;gradient descent on <i>protein</i> <i>specific</i> <i>potential</i> &quot;. I believe at that stage initial predicions are not used anymore (only as initial state).",1
UgxuMh3doEFVnDHb8-p4AaABAg,Amino acids are the basic building blocks of TERRESTRIAL life.,1
UgwD0TiQ0vJJNEt9cyR4AaABAg,Chaos could never produce these things.,1
UgyLe4gwicHu8I8Xu0x4AaABAg,Watched one AlphaFold video and I&#39;m now getting advertisements for pre-weighed biochemical research sample blisters.,1
Ugxql9zxdklqYRi2rNZ4AaABAg,Thanks i think i almost got that. The pretty squares helped a lot.<br>Its funny that the more powerful AI gets the more wrong you would be on the normie explanations of such breakthroughs. Add to the error the crudity of the english language and its chaotic adaptation by non mother tongue english speakers. <br>The ahh and umms are the mind sruggling to reach a truth approximation in english for the “deep mind” concept on offer.<br>Welcome to an unexplainable world of scientific breakthroughs getting weirder by the day.<br>Hopefully neuralink will make all these silly language issues disappear someday soon.,1
UgwB_28xD9xzo8IZ5-R4AaABAg,"I&#39;m actually here by suggested videos, where  the first video was about pimple popping.",2
UgzllJFlxpYKSKVVavV4AaABAg,"Can you provide (or provide a link) to someone who weighs out what  opp this creates for people like me, who have a bioscience background and are studying  big data? Pozdrav iz HR! Thank you.",1
UgxrEYhZLV80295QuMd4AaABAg,"The explanation torsion angles is false. What is described and drawn at minute <a href=""https://www.youtube.com/watch?v=B9PL__gVxLI&amp;t=1249"">20:49</a> are angles (3-body terms), torsion angles are dihedral angels between the two planes spanned by 4 neighbouring atoms (or any type of points).",1
UgwhZfmqiyd3EpNa9Ml4AaABAg,"Autobots, fold out!",4
UgwAhA2x8mxzViscl9B4AaABAg,WTF!,1
UgzjiPQX1PR3IOLxmNV4AaABAg,"<a href=""https://www.youtube.com/watch?v=B9PL__gVxLI&amp;t=580"">9:40</a> I think you mean ribosome?",2
Ugwa6VxHok2G5mDvz894AaABAg,Would love to see a biologists take on this,2
Ugz6gW7y_OHzANM0SfB4AaABAg,"Great job explaining everything. I&#39;m a   ~~protein engineering PhD student and all of the other videos I&#39;ve watch have played into the hype and not explained anything well. <br><br>Based off their CASP results they haven&#39;t solved anything yet but if they keep up this rate of innovation, they will in the next 2-4 years. They are absolutely killing the other big player in the field though (Rosetta), it is truly amazing what they have been able to accomplish.",10
UgxOiN5Ed7bTOhQj2_94AaABAg,"The iterative process is probably the folding step. Typically, when using one of the algorithms you will fold the protein thousands of times and build the final structure from a wieghed average of all the folded structures.",4
UgzEP-7jQ-aYMdK2JLx4AaABAg,So the end after the references is basically the supplimentals. I&#39;m not sure if that is common in CS papers but it just goes into detail on exactly how everything was done.,3
UgydAThUPKIRcF-nHDR4AaABAg,A new paper :<br>  Autoencoder Variationnal Auto encoding,3
Ugw75P322FWuUJ8e1hR4AaABAg,"Hey Yannic, great work on you videos, I really appreciate it. Could you cover the topic of lavasz loss and the respective paper &quot;The Lovasz-Softmax loss: A tractable surrogate for the optimization of the intersection-over-union measure in neural networks&quot; in future videos? I read that this specific jaccard approximation is used as loss function in many image segmentation tasks, even in U-net it has been observed that it gives better results. However it is not straightforward and I still don&#39;t fully get it. It would be awesome if you could create a video for it, breaking down the concept as you have done amazingly so many times. thank you :)",2
UgxuTvdpDfDfOBpE71Z4AaABAg,"Beau-ti-ful explanation. One of the best explanations of any subject I&#39;ve ever seen.<br><br>Brilliant turn from a complex matter to a understandable subject.<br><br>Ge-ni-us.<br><br>Congrats and, above all, Thank You Very, Very Much. Beau-ti-ful.",1
UgwJ0Z9Tx-uYZzbyXox4AaABAg,It&#39;s amazing how people are explaining things they don&#39;t know about,1
UgzHa_dhnLo-pc2qJCd4AaABAg,Cool,1
UgwEAj_rJNHbQclBpL14AaABAg,"<a href=""https://www.youtube.com/watch?v=B9PL__gVxLI&amp;t=2196"">36:36</a> ;)",1
UgzbHX3CTvdnRPui7Wt4AaABAg,Thank you. What stocks and sectors will benefit from this?,1
UgyqYSnrBlhCmZ8FxAJ4AaABAg,How about COVID?,1
Ugw6_71LdGq-wxiF6-l4AaABAg,"Really there are only 20 amino acids found in proteins encoded by genetic code, Selenocysteine which is found in about 50 eukaryotic proteins replaces cysteine by incorporating Se in place of S, not a huge structural change. There can also be post translational modifications. I bet that some more highly ordered proteins, such as those with a large number of alpha helices, and/or beta sheets  connected by more disordered strands are easier to predict as well as a larger data set from x-ray crystallography where protein homology aids the prediction. X-ray crystallography will still be important when looking at how other small molecules bind to proteins or how protein to protein interactions are observed.",3
Ugxg-xcYMEVBo5595RR4AaABAg,Elon entered the chat,1
UgzQIbw9UPQUAPQIpV14AaABAg,Cool,1
UgwUAlEkK_WKE_vEk0l4AaABAg,"at time <a href=""https://www.youtube.com/watch?v=B9PL__gVxLI&amp;t=1722"">28:42</a> take time out to review <a href=""https://en.wikipedia.org/wiki/Convolutional_neural_network"">https://en.wikipedia.org/wiki/Convolutional_neural_network</a>",1
Ugyte95abNhBRT2LO3d4AaABAg,"@<a href=""https://www.youtube.com/watch?v=B9PL__gVxLI&amp;t=1040"">17:20</a> the second line has &quot;NERDS&quot; in it.<br><br>That&#39;s it. That&#39;s my contribution to this discussion.",13
UgwGU6yNfljbF61zygZ4AaABAg,Can someone tell me what device does he use for overwriting on pdf with a pen and record it also?,1
UgxnEI7-4nWQLypxngt4AaABAg,<b>an AI solves 50 yo protein folding problem but I cant even still tie my shoelaces better</b>,2
UgyV3J4WjioLDPnGyoB4AaABAg,"Amazing video, thank you!",1
UgyAnuGTGCDpiKoaUXx4AaABAg,Honestly I am so fascinated by the papers but as someone who is new to the domain...it feels overwhelming...for eg..in this video the transformers were like a prerequisite and I feel there might be some prerequisite for every video maybe...<br>So is there like a playlist or some flow that someone could suggest.<br>Thanks,1
Ugy53y8DsHtmz0vW36d4AaABAg,"<a href=""https://occamstypewriter.org/scurry/2020/12/02/no-deepmind-has-not-solved-protein-folding/"">https://occamstypewriter.org/scurry/2020/12/02/no-deepmind-has-not-solved-protein-folding/</a>",0
UgzxTvKpWmolun7mMjN4AaABAg,Thanks for the video. Understandable for non-AI people too!,1
UgxnK3Ncg9jc-WTQlVJ4AaABAg,Central Dogma.......Second impact intensifies,2
UgxEiNDwf0nSDr7xomV4AaABAg,"Well, I guess Folding@Home is fked.",3
UgzJBRdKgrIJoPTCEJh4AaABAg,Very nice summary<br>Good visual explanations.<br>Enjoyed the alligator.<br>Thanks.,1
UgxnZ2FG4Sw2ZCTzatd4AaABAg,you explain things sooooo badly. you remind me of my days in high school.,1
UgyBqWrqydtOdo859hx4AaABAg,"A big issue with protein folding is that there are structures at many different scales. Small recursions wrap into large complexes, which fold into large knots. A CNN would in itself struggle to make those long chain assocations, alpha 2 has to be a transformer with attention in order to draw a relationship between the protein segment at position #2,736,203,023 and its nearby neighbor in 3d space, protein segment #72,720,022,853 millions of aminos down the line",2
UgxArW45exIk-l8ZMTR4AaABAg,"Yannic shocked that proteins compile themselves, whats gcc written in? 😏<br><br>also, as more of a life science person than an ML person this video explains proteins really well! and your gut instincts were right, its beta sheets not strands :)",1
UgzEWh6lemjsf7sdGtB4AaABAg,"alpha helix, beta sheet",1
UgyWCYXDU_3kRTr4g3p4AaABAg,I study biochemistry and the explanation about folding proteins is actually really good!,13
Ugwu49watdnzmlYn1yJ4AaABAg,I&#39;m fucking scared to death what this in the wrong hands will lead to.,0
UgzCCPxpbUOqg9QTTsF4AaABAg,"I like this video - but about the hype of the news... I dont buy it - not yet - and probably never. We are living in the age of hypes (thats also the reason why crowdfounding games can gather hundreds of millions of dollars)... thats why &#39;&#39;hyperloop&#39;&#39; works, thats why &#39;&#39;solar freaking roadways&#39;&#39; works. I mean works as hype to get millions of dollars. Sure its not always about money - its often enough a matter of prestige - and i dont say , that AlphaFold2 didnt achieved what they claim. I only doubt the MEANING of this achievement. And now i want to say a bold arrogant claim: <br>Unless THIS achievement, DIDNT lead within 5 years into: healing cancer, healing parkinson, anti-age, healing alzheimer desease, etc etc , this &#39;&#39;AlphaFold2&#39;&#39;-zero means almost nothing. <br>Now, i know, thats tough - but they did also a tough claim with hype-words like &#39;&#39;breakthrough&#39;&#39; ...&#39;&#39;on a 50 year old problem&#39;&#39; ...&#39;&#39;we solved &#39;the thing&#39; which causes parkinson, alzheimer, cancer etc in the first place&#39;&#39; .. SO they have to deliver. <br>Now, why i am so arrogant about this... <br>On the one side, like i said before: because we are living in hype-ages, i am not easy to jump into a hype. <br>And second, if i do comparisons to REAL medical breakthroughs which deserve the word - lets say: the invention of antibiotics... Penicillin truly solved in 5 years, worldwide really a LOT (!) of deadly deseases... let it: syphillis, cholera, tuberkulosis, hepatitis, all sorts of inflammatory deseases, etc etc ... Sure i dont say it solved everything - and sure, i dont say it solved it for all eternity (multiresistent gems) , BUT it was really kind of an holy grail , and it spread within few years around the globe - within 5 years, with one hit, a big amount of deseases really was solved. <br>AND that, ladies and gentlemen was over 80 years ago - with a much less efficient pharma-industry, and much less logistic capacities, without computers , etc etc etc.. <br><br>SO if the hype of this so called &#39;&#39;breakthrough&#39;&#39; deserves the word  - then we will see real world benefits within 5 years... and i mean benefits which we hear all the time about protein-folding-predictions (healing parkinsons, healing alzheimer,etc)... and not just &#39;we can now make plants with glowing leaves&#39; - not that shit. <br>And because i feel, that everyone feels that this will not happen - and therefore a lot of people will defend it like &#39;&#39;science doesnt work that way... science needs time&#39;&#39; etc , they only admit, that they feel like me... that this isnt a breakthrough. Its a small piece ... a very very VERY small piece in the big picture - and maybe in 200-300 years we benefit from it.",3
UgyDPmq4C1vaxF5wt5d4AaABAg,"<a href=""https://www.youtube.com/watch?v=B9PL__gVxLI&amp;t=1212"">20:12</a>  Till this moment. The Idea is that, train a network which reads the sequence of amino acids and predicts their distance. Stage 2 do the gradient descending in order to both generate something real spacial data in the form of vector3d and check if the prediction from stage 1 is possible. If it&#39;s not possible, let&#39;s say, distance(point 1,point 2) == 1, d(2,3)== 1,but d(1,3)== 3, the stage 2 has to deal with this, and gives out a result which fulfill all the distance prediction as possible.",1
UgzHbwqiERxKunAv8e94AaABAg,Watched 4 mins... Such a boring video. Waste of time,1
UgxmMmRC0NwzsDG_F-V4AaABAg,Learning to learn by Yannic Kilcher <br>                               by Yannic Kilcher,1
UgxcRxHioOKMJQQCbqx4AaABAg,"What do you mean when you say at <a href=""https://www.youtube.com/watch?v=B9PL__gVxLI&amp;t=615"">10:15</a> that helicase is probably &quot;conserved in the evolutionary tree&quot;?",2
UgxlZpyPU7SWcHUGAoJ4AaABAg,"This short intro to protein folding has some nice animations that are so mind boggling. <a href=""https://www.youtube.com/watch?v=zm-3kovWpNQ"">https://www.youtube.com/watch?v=zm-3kovWpNQ&amp;ab_channel=TEDxTalks</a>",0
